Initial Search Date,City,State,Category 1,Category 2,Category 3,Type of Artificial Intelligence,Name of Tool ,Vendor or Name of Tech (if applicable),Vendor Link,Domain,Stage of Deployment ,Individual vs. Organizational Use,"Description of Tool in your own words
(1-2 sentences)  ",Host Name 1 ,Host Name 2 ,Host Name 3 ,Host Name 4,Link 1,Link 2,Link 3,Link 4,Citations,,,,Found Details OR Last Searched Date ,# Total Cases Per City,Corrections ,Courts,Law Enforcement,New or Old RAs? 
04/23,New York City,New York,Detection,,,Gun Detection Technology: Transit ,Evolv Express ,"Evolv Technologies, Inc",https://evolv.com/ ,Law Enforcement,Inactive ,Organizational Use ,"Evolv Express® uses advanced sensor technology and AI and is designed 
to enhance security, create situational awareness by alerting on potential
threats, and support threat response with a “Red Box” directed search.",statescoop.com,,,,https://statescoop.com/nypd-ai-gun-detection-scanners-subway/,https://bronx.news12.com/ai-powered-weapon-scanners-fail-pilot-program-in-new-york-city-subways,https://www.thedailybeast.com/mayor-adams-nypd-launch-test-of-ai-scanners-in-nyc-subways/,,"Quinlan, K. (2024, March 28). NYPD to test AI-powered gun-detection scanners in subway system. StateScoop. https://statescoop.com/nypd-ai-gun-detection-scanners-subway/","Lilley, N. (2024). AI-powered weapon scanners fail pilot program in New York City subways. News 12 . https://bronx.news12.com/ai-powered-weapon-scanners-fail-pilot-program-in-new-york-city-subways",,,10/20/25,14,2,2,7,Old RA's 
04/23,New York City,New York,Surveillance,,,Body Camera Footage Review,Truleo AI,TRULEO ,http://truleo.co/,Law Enforcement,Active ,Organizational Use ,"Truleo is an artificial intelligence system that reviews body-camera footage to identify key events such as use of force, arrests, or unprofessional language. It transcribes and analyzes officer-civilian interactions in near real time, helping supervisors detect misconduct, improve training, and enhance accountability within the department. ",www.fox5ny.com,,,,https://www.fox5ny.com/news/nypd-to-use-ai-to-review-body-camera-footage,https://nycpba.org/news-items/gothamist/2023/the-nypd-is-using-ai-to-analyze-body-camera-footage-civil-rights-activists-have-privacy-concerns/,,,"Priolo, T. (2023, October 19). NYPD to use AI to review body camera footage. FOX 5 NY. https://www.fox5ny.com/news/nypd-to-use-ai-to-review-body-camera-footage","Ostadan, B. (2020). The NYPD is using AI to analyze body camera footage. Civil rights activists have privacy concerns.Nycpba.org. https://nycpba.org/news-items/gothamist/2023/the-nypd-is-using-ai-to-analyze-body-camera-footage-civil-rights-activists-have-privacy-concerns/",,,10/20/25,14,2,2,7,Old RA's 
04/23,New York City,New York,Surveillance,,,Facial Recognition Technology,Clearview AI 2.0,"Clearview AI, Inc. ",https://www.clearview.ai/,Law Enforcement,Active ,Organizational Use ,"Clearview AI is a facial recognition system used by law enforcement agencies to identify people from photos or videos. It works by comparing an uploaded image against a massive database of pictures collected from social media and other public websites, returning possible matches within seconds. In this context, New York police departments have used the tool to assist in investigations and identify suspects.",www.nyclu.org,,,,https://www.nyclu.org/press-release/nyclu-statement-buzzfeed-investigation-revealing-clearview-ai-use-ny-police,https://www.brennancenter.org/our-work/research-reports/new-york-city-police-department-surveillance-technology,,,"Schaefer, B. (2021, April 7). NYCLU Statement on Buzzfeed Investigation Revealing Clearview AI Use by NY Police Departments. NYCLU. https://www.nyclu.org/press-release/nyclu-statement-buzzfeed-investigation-revealing-clearview-ai-use-ny-police","Diaz, A. (2019, October 4). New York City Police Department Surveillance Technology. Brennan Center for Justice. https://www.brennancenter.org/our-work/research-reports/new-york-city-police-department-surveillance-technology",,,10/20/25,14,2,2,7,Old RA's 
04/23,New York City,New York,Forensic Analysis,,,Investigation Tool Crime Pattern Algorithm,Patternizr,New York Police Department ,,Law Enforcement,Active ,Organizational Use ,"Patternizr is an artificial intelligence tool used by the NYPD to find patterns across thousands of crime reports. It analyzes details like the method of entry, location, time, and type of weapon to identify crimes that may have been committed by the same person or group. By automatically grouping related cases, it helps detectives make connections more quickly, prioritize investigations, and focus resources on identifying suspects. In this context, Patternizr serves as an investigative aid designed to speed up case-solving and improve efficiency across the department.",www.governing.com,,,,https://www.governing.com/archive/gov-new-york-police-nypd-data-artificial-intelligence-patternizr.html,,,,"Charles, J. (2019, March 19). NYPD’s Big Artificial-Intelligence Reveal. Governing. https://www.governing.com/archive/gov-new-york-police-nypd-data-artificial-intelligence-patternizr.html",,,,10/20/25,14,2,2,7,Old RA's 
04/23,New York City,New York,Surveillance ,,,Social Media Tracking ,Voyager Labs' social-media surveillance & analytics suite,Voyager Labs,,Law Enforcement,Active ,Organizational Use ,"Voyager Labs is an artificial intelligence platform that analyzes social media data to map relationships, detect online behavior patterns, and flag individuals who may be involved in or planning criminal activity. It uses algorithms to scan posts, comments, and connections across multiple platforms to identify potential threats or networks of interest. In this context, the NYPD has used Voyager Labs to monitor social media activity and support investigations. ",www.businessinsider.com,,,,https://www.businessinsider.com/nypd-new-york-police-voyager-labs-social-media-surveillance-crime-2023-9,,,,"Hawkinson, K. (2023, September 10). NYC police use products from company that claims it can predict crime. Business Insider. https://www.businessinsider.com/nypd-new-york-police-voyager-labs-social-media-surveillance-crime-2023-9",,,,10/20/25,14,2,2,10,Old RA's 
04/24,New York City,New York,Front End Support,,,AI Avatar: Defendant Counsel ,Tavus,Tavus,,Courts,Active ,Individual Use ,"The Tavus tool allows users to create and animate a synthetic avatar which delivers a pre-recorded or AI-generated presentation in a video format. In this case, a litigant submitted the avatar video to represent his argument in court without disclosing it was AI-generated.
",www.cnn.com,,,,https://www.cnn.com/2025/04/10/us/video/ai-generated-avatar-new-york-court-digvid,https://apnews.com/article/artificial-intelligence-ai-courts-nyc-5c97cba3f3757d9ab3c2e5840127f765,https://nypost.com/2025/04/05/us-news/new-york-court-addressed-by-ai-avatar-to-argue-case/,,"Tang, H. (2025, April 10). See judge shut down argument from AI avatar in court. CNN. https://www.cnn.com/2025/04/10/us/video/ai-generated-avatar-new-york-court-digvid","Neumeister, L. (2025, April 4). An AI avatar tried to argue a case before a New York court. The judges weren't having it. AP News. https://apnews.com/article/artificial-intelligence-ai-courts-nyc-5c97cba3f3757d9ab3c2e5840127f765","Associated Press. (2025, April 5). AI avatar tried to argue a case before New York court -- but judges weren't having it. New York Post. https://nypost.com/2025/04/05/us-news/new-york-court-addressed-by-ai-avatar-to-argue-case/",,10/20/25,14,2,2,10,Old RA's 
04/25,New York City,New York,Back End Administration,,,GenAI Citations in Court Cases,Gemini,Google,https://gemini.google.com/,Courts,Active ,Individual Use ,"Google Bard is a conversational AI chatbot that generates text, answers questions, and summarizes information based on user prompts. It uses large language model technology to mimic human writing and reasoning.",www.reuters.com,,,,https://www.reuters.com/technology/artificial-intelligence/ai-hallucinations-court-papers-spell-trouble-lawyers-2025-02-18/,https://www.nyestatelitigationblog.com/2024/01/articles/uncategorized/matter-of-samuel-artificial-intelligence-hallucinates-and-an-incapacitated-person-makes-a-will/,,,"Merken, S. (2025, February 18). AI “hallucinations” in court papers spell trouble for lawyers. Reuters. https://www.reuters.com/technology/artificial-intelligence/ai-hallucinations-court-papers-spell-trouble-lawyers-2025-02-18/","Santoro, F. T. (2024, January 29). Matter of Samuel - Artificial Intelligence Hallucinates and an Incapacitated Person Makes a Will. New York Trusts & Estates Litigation. https://www.nyestatelitigationblog.com/2024/01/articles/uncategorized/matter-of-samuel-artificial-intelligence-hallucinates-and-an-incapacitated-person-makes-a-will/",,,10/20/25,14,2,2,10,Old RA's 
04/25,New York City,New York,Surveillance,,,Prisoner Phone Call Monitoring,Inmate Telephone System ,ViaPath Technologies,https://www.viapath.com/,Corrections,Active ,Individual Use ,Investigator Pro is a voice biometric tool that analyzes phone audio to confirm whether the speaker matches the enrolled incarcerated person and to detect when someone may be using another person’s PIN. It supports investigations by flagging suspicious calls and helping staff link voices across different numbers and call records.,www.osc.ny.gov,,,,https://www.osc.ny.gov/press/releases/2025/04/dinapoli-improved-guidance-needed-state-agencies-using-ai-avoid-risks,https://www.wwlp.com/news/audit-ai-oversight-lacking-at-new-york-state-agencies/amp/,https://www.yorkdispatch.com/story/news/local/york-county/2024/01/26/how-will-york-county-use-artificial-intelligence-in-its-prison-and-what-information-is-it-gathering/72326444007/,https://abcnews.go.com/Technology/us-prisons-jails-ai-mass-monitor-millions-inmate/story?id=66370244,"Dinapoli, T. (2025, April 3). DiNapoli: Improved Guidance Needed for State Agencies Using AI To Avoid Risks. Office of the New York State Comptroller. https://www.osc.ny.gov/press/releases/2025/04/dinapoli-improved-guidance-needed-state-agencies-using-ai-avoid-risks","Sheridan, J. (2025, April 8). Audit: AI oversight lacking at New York state agencies. WWLP. https://www.wwlp.com/news/audit-ai-oversight-lacking-at-new-york-state-agencies/amp/","Enright, M. (2024, January 26). How will York County use artificial intelligence in its prison? York Dispatch. https://www.yorkdispatch.com/story/news/local/york-county/2024/01/26/how-will-york-county-use-artificial-intelligence-in-its-prison-and-what-information-is-it-gathering/72326444007/","Francescani, C. (2019, October 24). US prisons and jails using AI to mass-monitor millions of inmate calls. ABC News. https://abcnews.go.com/Technology/us-prisons-jails-ai-mass-monitor-millions-inmate/story?id=66370244",10/20/25,14,2,2,10,Old RA's 
04/25,New York City,New York,Detection ,,,Contraband Detection,N/A,N/A,,Corrections,Unsure,Organizational ,N/A,scholarship.shu.edu,,,,https://scholarship.shu.edu/cgi/viewcontent.cgi?article=2648&context=student_scholarship,,,,"Mohktar, R. (2025). The Transformation of Correctional Facilities Using Artificial Intelligence Technology. Seton Hall University. https://scholarship.shu.edu/cgi/viewcontent.cgi?article=2648&context=student_scholarship",,,,10/20/25,14,2,2,10,Old RA's 
04/25,New York City,New York,Prediction,,,Predictive Algorithm: Severe Harm for Children,Severe Harm Predictive Model (SHM),New York City Administration for Children’s Services,,Law Enforcement,Active ,Organizational Use ,"SHM uses historical child-welfare data to assess how likely a child is to suffer serious harm (physical or sexual abuse) within the next 18 months, so ACS can prioritize which cases to investigate more urgently.",www.vice.com,,,,https://www.vice.com/en/article/nypd-child-services-ai-facial-recognition/,,,,"Abraham, R. (2023, February 22). AI Use by Cops, Child Services In NYC Is a Mess: Report. VICE. https://www.vice.com/en/article/nypd-child-services-ai-facial-recognition/",,,,10/20/25,14,2,2,10,Old RA's 
03/22,New York City,New York,,,,Real Time Crime/Fusion Centers,Axon Fusus,"Axon Enterprise, Inc.",https://www.axon.com/,Law Enforcement,Active ,Organizational Use ,Axon Fusus is a camera integration platform that allows for businesses to integrate their security cameras with their local police department's precinct. The New York Police Department is collaborating with businesses who will voluntarily share information with the NYPD to assist in solving crimes and protecting public safety.,www.nyc.gov,,,,https://www.nyc.gov/mayors-office/news/2024/05/mayor-adams-new-pilot-program-combat-retail-theft-create-efficiencies-improve,,,,"Mayor’s Office of the Mayor. (2024, May 16). Mayor Adams announces new pilot program to combat retail theft, create efficiencies, and improve public safety. City of New York. https://www.nyc.gov/mayors-office/news/2024/05/mayor-adams-new-pilot-program-combat-retail-theft-create-efficiencies-improve",,,,03/22/26,14,2,,,
03/22,New York City,New York,,,,Gun Detection,ShotSpotter,"SoundThinking, Inc.",https://www.soundthinking.com/,Law Enforcement,Active ,Organizational Use ,"ShotSpotter is an acoustic gunshot detection system that helps reduce response time to gunfire incidents, assists with evidence collection, and locates victims. The New York Police Department partners with ShotSpotter to continue to maintain improved accuracy of identifying gunfire and responding rapidly. ",ir.soundthinking.com,,,,https://ir.soundthinking.com/news-events/press-releases/detail/305/soundthinking-announces-a-shotspotter-three-year---renewal,,,,"SoundThinking, Inc. (2025, February 18). SoundThinking announces a ShotSpotter three‑year renewal with New York City Police Department [Press release]. IR SoundThinking. https://ir.soundthinking.com/news-events/press-releases/detail/305/soundthinking-announces-a-shotspotter-three-year---renewal",,,,03/22/26,14,2,,,
03/22,New York City,New York,,,,Drone Technology,Skydio X10,"Skydio, Inc.",https://www.skydio.com/,Law Enforcement,Active ,Organizational Use ,"Skydio's Drone as First Responder program assists officers in enhancing speed, safety, and efficiency through providing live aerial intelligence. The New York Police Department utilizes this program to search for missing persons, provide rapid response surveillance to crimes, and overall enhance efficiency in crime response.",insideunmannedsystems.com,,,,https://insideunmannedsystems.com/drones-as-first-responder-go-aloft-in-nyc/,https://www.skydio.com/resources/videos/new-york-city-expands-drone-program-seeing-real-results-in-keeping-the-community-safer,,,"Roblin, S. (2025, September 30). Drones as first responder go aloft in NYC. Inside Unmanned Systems. https://insideunmannedsystems.com/drones-as-first-responder-go-aloft-in-nyc/",,,,03/22/26,14,2,,,
03/22,New York City,New York,,,,AI-Assisted Police Reports / Body Cameras,Axon Body 3 / 4,"Axon Enterprise, Inc.",https://www.axon.com/,Law Enforcement,Active ,Organizational Use ,"Axon's Body Cameras allow for enhanced evidence capture and real-time situational awareness/support for law enforcement officers. The New York Police Department utilizes these body cameras to record any engaged police action, and the footage can later be reviewed for assessment of constitutionality of a situation, investigate a misconduct allegation, and more.",comptroller.nyc.gov,,,,https://comptroller.nyc.gov/reports/review-of-the-new-york-city-police-departments-body-worn-camera-program/,,,,"Office of the New York City Comptroller. (2025, October 31). Review of the New York City Police Department’s body‑worn camera program. https://comptroller.nyc.gov/reports/review-of-the-new-york-city-police-departments-body-worn-camera-program/",,,,03/22/26,14,2,,,
04/26,Los Angeles,California,Surveillance,,,Body Camera Footage Review,N/A,"Axon Enterprise, Inc.",https://www.axon.com/,Law Enforcement,Active ,Organizational Use ,Researchers are using AI to analyze the tone and word choice that LAPD officers use during traffic stops in order to improve officer training on navigating encounters with the public. ,dornsife.usc.edu,,,,https://dornsife.usc.edu/news/stories/ai-meets-policing/,https://www.govtech.com/public-safety/los-angeles-police-to-use-ai-analysis-of-body-cam-footage,https://www.latimes.com/california/story/2023-08-22/lapd-to-use-ai-to-analyze-body-cam-videos-for-officers-language-use,https://www.inc.com/will-yakowicz/axon-artificial-intelligence-software-lapd-body-camera-footage.html,"Liu, M. (2023, September 1). Artificial intelligence (AI) meets policing: USC leads LAPD body cam study. News and Events. https://dornsife.usc.edu/news/stories/ai-meets-policing/","Yakowicz, W. (2017, October 18). Artificial Intelligence Software Will Be Helping the Los Angeles Police. Inc. https://www.inc.com/will-yakowicz/axon-artificial-intelligence-software-lapd-body-camera-footage.html","Jany, L. (2023, August 22). LAPD to use AI to analyze body cam videos for officers’ language use. Los Angeles Times. https://www.latimes.com/california/story/2023-08-22/lapd-to-use-ai-to-analyze-body-cam-videos-for-officers-language-use",,10/27/25,14,1,4,9,Old RA's 
04/26,Los Angeles,California,Prediction,,,Crime Prediction Technology: Crime Heat Maps ,PredPol,Geolitica,,Law Enforcement,Inactive ,Organizational Use ,"The Predpol predictive-policing program analyzed data to increase police presence in areas where crime seemed likely to take place, relying on 10 years of crime data. In April 2020, the LAPD canceled its contract with PredPol. ",www.cnn.com,,,,https://www.cnn.com/2019/03/22/tech/lapd-audit-tech/index.html,,,,"McFarland, M. (2019, March 22). LAPD audit reveals dangers of high-tech policing. CNN. https://www.cnn.com/2019/03/22/tech/lapd-audit-tech/index.html",,,,10/27/25,14,1,4,9,Old RA's 
04/26,Los Angeles,California,Prediction,,,Crime Prediction Technology: Crime Heat Maps ,Palantir Gotham ,Palantir Technologies,https://www.palantir.com/,Law Enforcement,Unsure,Organizational Use ,"The Palantir platform offers a centralized location to collect and analyze police data, including license-plate scans, rap sheets, foreclosed properties, and traffic tickets. This allows the LAPD to increase police presence in areas where crime seems likely to take place. ",www.cnn.com,,,,https://www.cnn.com/2019/03/22/tech/lapd-audit-tech/index.html,,,,"McFarland, M. (2019, March 22). LAPD audit reveals dangers of high-tech policing. CNN. https://www.cnn.com/2019/03/22/tech/lapd-audit-tech/index.html",,,,10/27/25,14,1,4,9,Old RA's 
04/26,Los Angeles,California,Back End Administration,,,Digital Court Reports Generator & Analytics,Client Case Management System,Publicis Sapient,,Courts,Active ,Organizational Use ,"The Los Angeles County Public Defender's Office (LACPD) employs an AI system which quickly identifies information useful to attorneys, enhancing the quality and speed of their work. ",www.tdcaa.com,,,,https://www.tdcaa.com/journal/an-ai-primer-for-prosecutors-on-its-peril-and-potential/,https://www.thomsonreuters.com/en-us/posts/government/leveraging-genai-tools-courts/,https://www.cio.com/article/2075465/la-public-defender-cio-digitizes-to-divert-people-to-programs-not-prison.html,https://www.govtech.com/biz/can-better-software-lead-to-better-outcomes-in-court,"Holley, M. (2024, July-August). An AI primer for prosecutors on its peril and potential | Texas District & County Attorneys Association. Texas District & County Attorneys Association. https://www.tdcaa.com/journal/an-ai-primer-for-prosecutors-on-its-peril-and-potential/","Brunette, A. (2024, April 9). Leveraging GenAI tools in courts contains opportunities and challenges. Thomson Reuters Institute. https://www.thomsonreuters.com/en-us/posts/government/leveraging-genai-tools-courts/","Rooney, P. (2024, March 28). LA Public Defender CIO digitizes to divert people to programs, not prison. CIO. https://www.cio.com/article/2075465/la-public-defender-cio-digitizes-to-divert-people-to-programs-not-prison.html","Rueter, T. (2023, October 27). Can Better Software Lead to Better Outcomes in Court? GovTech. https://www.govtech.com/biz/can-better-software-lead-to-better-outcomes-in-court",10/27/25,14,1,4,9,Old RA's 
04/26,Los Angeles,California,Prediction ,,,Crime Prediction Technology: Offender Predictor Algorithm ,Operation Laser,Palantir Technologies,https://www.palantir.com/,Law Enforcement,Inactive ,Organizational Use ,"The LAPD rolled out the data-driven LASER predictive policing program in 2011, which was created to target individuals most likely to commit a violent crime based on personal criminal histories. In 2019, the LAPD Inspector General's internal audit of LASER found issues in the way individuals were selected by the program. The LAPD shut down LASER. ",www.cbsnews.com,,,,https://www.cbsnews.com/news/los-angeles-police-department-laser-data-driven-policing-racial-profiling-2-0-cbsn-originals-documentary/,,,,"Baek, G. (2020, February 23). LAPD not giving up on data-driven policing, even after scrapping controversial program. CBS News. https://www.cbsnews.com/news/los-angeles-police-department-laser-data-driven-policing-racial-profiling-2-0-cbsn-originals-documentary/",,,,10/27/25,14,1,4,9,Old RA's 
04/26,Los Angeles,California,Forensic Analysis,,,DNA Analysis,GEDmatch,GEDmatch,,Law Enforcement,Active ,Organizational Use ,"Police checked the crime scene DNA of the ""Golden State Killer"" against GEDmatch, a database filled with the profiles of people who have volunteered their genetic codes to discover their relatives. After years, they were able to identify the killer. ",opendatascience.com,,,,https://opendatascience.com/3-examples-of-ai-helping-police-solve-cold-cases/,,,,"Amos, Z. (2024, November 26). 3 Examples of AI Helping Police Solve Cold Cases. Open Data Science - Your News Source for AI, Machine Learning & More. https://opendatascience.com/3-examples-of-ai-helping-police-solve-cold-cases/",,,,10/27/25,14,1,4,9,Old RA's 
04/26,Los Angeles,California,Back End Administration,,,Case Management Tool,Client Case Management System ,Amazon Web Services,,Courts,Active ,Organizational Use ,"The LACPD began using an AI-powered document processing system to reduce manual data entry. This system ""ingests scanned PDFS, classifies useful pages, extracts agency-specific information and allows the Public Defender's office staff to verify results through a user interface."" ",statescoop.com,,,,https://statescoop.com/la-county-public-defender-ai-aws/,,,,"Quinlan, K. (2023, July 12). L.A. County’s public defender uses AI to improve client management. StateScoop. https://statescoop.com/la-county-public-defender-ai-aws/",,,,10/27/25,14,1,4,9,Old RA's 
04/26,Los Angeles,California,Back End Administration,,,Virtual Reality Training,Apple Vision Pro Goggles,Apple,,Law Enforcement,Unsure,Organizational Use ,"The LAPD implemented a virtual reality training program for officers at the LA Police Academy, focusing on de-escalation tactics and other skills. They use the Apple Vision Pro Goggles, which double as a computer. ",www.police1.com,,,,https://www.police1.com/tech-pulse/leading-the-digital-beat-lapds-deputy-chief-talks-technologys-role-in-shaping-the-future-of-policing,,,,"Calams, S. (2024, February 13). Leading the digital beat: LAPD’s deputy chief talks technology’s role in shaping the future of policing. Police1. https://www.police1.com/tech-pulse/leading-the-digital-beat-lapds-deputy-chief-talks-technologys-role-in-shaping-the-future-of-policing",,,,10/27/25,14,1,4,9,Old RA's 
04/26,Los Angeles,California,Front End Support,,,Chatbot: Jury Assistance ,Jury Chatbot,Microsoft Cognitive Services,,Courts,Unsure,Organizational Use ,"The Superior Court of Los Angeles is currently working on a Jury Chat Bot project leveraging true AI with features like natural language understanding, QnA maker, and translation services. Efforts are being focused around the jury summons process. ",www.zdnet.com,,,,https://www.zdnet.com/article/ai-in-the-court-are-robot-judges-next/,,,,"Condon, S. (2020, January 22). AI in the court: Are robot judges next? ZDNET. https://www.zdnet.com/article/ai-in-the-court-are-robot-judges-next/",,,,10/27/25,14,1,4,9,Old RA's 
04/27,Los Angeles,California,Back End Administration,,,Redaction Technology ,N/A,Accenture PLC,,Courts,Unsure,Organizational Use ,The trial courts in Los Angeles County are testing a new AI tool that removes personal data from case files involving minors. ,news.bloomberglaw.com,,,,https://news.bloomberglaw.com/litigation/ai-tool-to-redact-minors-info-in-testing-for-los-angeles-court,,,,"Spoto, M. (2023, December 8). AI Tool to Redact Minors’ Info in Testing for Los Angeles Court. @BLaw. https://news.bloomberglaw.com/litigation/ai-tool-to-redact-minors-info-in-testing-for-los-angeles-court",,,,10/27/25,14,1,4,9,Old RA's 
04/30,Los Angeles,California,Surveillance ,Prediction ,Back End Administration,AI Inmate Search System,"LA County Inmate Search, Inmate Search Los Angeles, LA Sherrif Inmate Search ",N/A,,Corrections,Inactive ,Organizational Use ,"Artificial intelligence and machine learning are enhancing efficiency, accuracy, and security in managing inmate information via predictive analytics, enhanced safety measures, and streamlined administrative tasks. ",patch.com,,,,https://patch.com/california/los-angeles/classifieds/other/453907/impact-of-artificial-intelligence-and-machine-learning,https://midnightbail.com/lasd-inmate-search/,,,"Local Classified: Impact of Artificial Intelligence and Machine Learning. (2024, June 18). Los Angeles, ca Patch. https://patch.com/california/los-angeles/classifieds/other/453907/impact-of-artificial-intelligence-and-machine-learning",,,,10/27/25,14,1,4,9,Old RA's 
