09/21,Kansas City,Missouri ,Surveillance,,,Security Robots,Lance,Patmos Tech,,Law Enforcement,Active,Individual Use,"Lance, the security robot being used at the Kansas City Patmos HQ, is a 5-foot tall security robot that uses remote-control modes and a 360-degree camera to capture the surrounding area and detect crime.",www.govtech.com,,,,https://www.govtech.com/public-safety/can-a-security-robot-help-protect-kansas-city-mo,https://www.kmbc.com/article/kansas-city-shopping-center-credits-security-robot-with-crime-reduction/62001031,,,"Green, PJ. (2025, September 15). Can a security robot help protect Kansas City, Mo.? GovTech. https://www.govtech.com/public-safety/can-a-security-robot-help-protect-kansas-city-mo",,,,11/29/25,3,0,0,3,Old RA's 
09/21,Kansas City,Missouri ,Detection,,,Automated License Plate Recognition,Flock LPR Cameras ,Flock Safety,https://www.flocksafety.com/,Law Enforcement,Active,Organizational Use,"Flock Safety's License Plate Readers use AI image recognition and matching capabilities to match license plates read through devices with suspect license plates, leading to supposed recovery of stolen vehicles and criminal arrests.",www.kake.com,,,,https://www.kake.com/ai-enhanced-camera-technology-helps-suburban-kansas-city-police-department-solve-murder/article_e98fb880-4247-52af-868d-4f3eca8a6714.html,https://statescoop.com/ai-camera-arrest-missouri-blue-springs-2024/,,,"KAKE News Staff. (2024, April 28). AI-enhanced camera technology helps suburban Kansas City Police Department solve murder. KAKE. https://www.kake.com/ai-enhanced-camera-technology-helps-suburban-kansas-city-police-department-solve-murder/article_e98fb880-4247-52af-868d-4f3eca8a6714.html",,,,11/29/25,3,0,0,3,Old RA's 
09/21,Kansas City,Missouri ,Surveillance,,,Facial Recognition Technology ,N/A,SafeSpace Global Corporation,,Law Enforcement,Active,Organizational Use,"In a partnership between Kansas City Area Transportation Authority (KCATA) and SafeSpace Global Corporation, facial recognition cameras are being placed in public buses. The cameras can analyze rider behavior, identify individuals listed in law enforcement databases, and alert security personnel to potential risks based on motion and sound.",idtechwire.com,,,,https://idtechwire.com/kansas-city-to-pilot-ai-cameras-with-facial-recognition-on-select-bus-routes/,https://idtechwire.com/kansas-city-to-pilot-ai-cameras-with-facial-recognition-on-select-bus-routes/,,,"IDTechWire Staff. (2025, August 6). Kansas City to Pilot AI Cameras With Facial Recognition on Select Bus Routes. IDTechWire. https://idtechwire.com/kansas-city-to-pilot-ai-cameras-with-facial-recognition-on-select-bus-routes/",,,,11/29/25,3,0,0,3,Old RA's 
07/13,Raleigh,North Carolina ,Detection,Surveillance ,,Citizen Footage Integration: Object Identification,Fusus through ConnectRaleigh,"Axon Enterprise, Inc.",https://www.axon.com/,Law Enforcement,Active,Organizational Use,"The ConnectRaleigh program utilizes the Axon Fusus platform to rapidly search live video provided to the system by users, in order to track and eliminate criminal activity.",abc11.com,,,,https://abc11.com/post/raleigh-police-security-cameras-access-connectraleigh/14417162/,, ,,"Scofield, S. (2024, February 12). Raleigh Police address privacy concerns about its new camera-sharing program. ABC11/WTVD. https://abc11.com/post/raleigh-police-security-cameras-access-connectraleigh/14417162/",, ,,10/27/25,2,0,0,2,Old RA's 
07/13,Raleigh,North Carolina,Back End Administration,,,AI Hallucination,Vincent AI,vLex,,Law Enforcement,Active ,Individual Use ,"In a negligence lawsuit against Raleigh, North Carolina stemming from a fallen tree branch, the plaintiff’s brief cited two non-existent North Carolina cases, and the plaintiff’s lawyer disclosed that a contract attorney used an AI legal research tool called Vincent AI. The city’s attorneys urged the North Carolina Court of Appeals to use the matter as a precedent-setting caution against “overreliance” on AI in legal filings.  ￼",www.carolinajournal.com,,,,https://www.carolinajournal.com/ai-error-in-lawsuit-against-raleigh-could-prompt-nc-court-response/,,,,,,,,11/5/26,2,0,,,New RAs
07/14,Colorado Springs,Colorado,Back End Administration,,,Body Camera Footage Review: AI-Generated Reports,Draft One,"Axon Enterprise, Inc.",https://www.axon.com/,Law Enforcement,Active,Organizational Use,Axon Draft One is an AI tool that generates draft police reports from body-worn cameras and interview footage. ,www.fox21news.com,,,,https://www.fox21news.com/news/cspd-rolls-out-new-technology-with-ai-assistance/,https://successquarterly.com/colorado-springs-police-deploy-ai-driven-body-cameras-to-enhance-efficiency/,,,"Sack, A. (2025, January 22). CSPD rolls out new technology with AI assistance. FOX21 News Colorado. https://www.fox21news.com/news/cspd-rolls-out-new-technology-with-ai-assistance/","Staff, S. (2025, January 23). Colorado Springs Police Deploy AI-Driven Body Cameras to Enhance Efficiency. SUCCESS QUARTERLY | Business, Tech & Trends That Matter; SUCCESS QUARTERLY | Business, Tech & Trends That Matter. https://successquarterly.com/colorado-springs-police-deploy-ai-driven-body-cameras-to-enhance-efficiency/",,,11/17/25,10,0,0,8,Old RA's 
07/14,Colorado Springs,Colorado,Back End Administration,,,AI Citation Court Motion,ChatGPT,OpenAI,,Courts ,Inactive,Individual Use,Colorado's presiding disciplinary judge imposed a professional sanction on an attorney for using artificial intelligence to generate fake citations in a legal brief and then lying about it. ,www.coloradopolitics.com,,,,https://www.coloradopolitics.com/courts/appeals-court-warns-lawyers-litigants-you-will-get-in-trouble-for-citing-ai-invented-cases/article_7e9f57e6-c47f-11ef-9c33-270978ccedcf.html,https://www.dailymail.co.uk/news/article-13367897/Colorado-attorney-suspended-bar-fired-chatgpt-ai.html,https://www.lawweekcolorado.com/article/colorado-lawyer-cited-fake-cases-in-motion-written-with-chatgpt/,,"Karlik, M. and Colorado Politics (2024, December 27). Appeals court warns lawyers, litigants: You will get in trouble for citing AI-invented cases. Colorado Politics. https://www.coloradopolitics.com/courts/appeals-court-warns-lawyers-litigants-you-will-get-in-trouble-for-citing-ai-invented-cases/article_7e9f57e6-c47f-11ef-9c33-270978ccedcf.html","Kelley, B. J. (2025, July 7). Mike Lindell’s Attorneys Fined for Using AI During Defamation Trial. Westword. https://www.westword.com/news/mike-lindells-attorneys-fined-for-using-ai-during-recent-trial-24991543","Srivastava, I. (2024, April 30). Colorado attorney is suspended from the bar and fired from his firm for using ChatGPT in court after... Mail Online; Daily Mail. https://www.dailymail.co.uk/news/article-13367897/Colorado-attorney-suspended-bar-fired-chatgpt-ai.html",,11/17/25,10,0,0,8,Old RA's 
07/14,Colorado Springs,Colorado ,Front End Support ,,,AI-enabled virtual assistant,AskCOS,Citibot,,Law Enforcement,Active ,Organizational Use ,Built a ChatBox based on Colorado Springs information that helps residents in different languages resolve city complaints; Could give guidance in resolve civil citations. ,www.govtech.com,,,,https://www.govtech.com/artificial-intelligence/colorado-springs-chatbot-is-powered-by-ai-city-data,,,,"Edinger, J. (2024, May 24). Colorado Springs Chatbot Is Powered by AI, City Data. Government Technology. https://www.govtech.com/artificial-intelligence/colorado-springs-chatbot-is-powered-by-ai-city-data",,,,11/6/25,10,0,,,New RAs
07/14,Colorado Springs,Colorado ,Back End Administration,,,AI Hallucination ,ChatGPT,OpenAI,,Courts ,Inactive ,Individual Use ,N/A,www.reuters.com,,,,https://www.reuters.com/legal/transactional/more-judges-lawyers-confront-pitfalls-artificial-intelligence-2023-06-16/,,,,"Merken, S. (2023, June 16). More judges, lawyers confront pitfalls of artificial intelligence. Reuters. https://www.reuters.com/legal/transactional/more-judges-lawyers-confront-pitfalls-artificial-intelligence-2023-06-16/",,,,11/6/25,10,0,,,New RAs
03/30,Colorado Springs,Colorado ,,,,Real-Time Crime / Fusion Centers,Axon Fusus,"Axon Enterprise, Inc.",,Law Enforcement,Active ,Organizational Use ,"Axon Fusus aggregates live feeds from cameras, drones, license plate readers, and other sensors into a single map-based interface, giving law enforcement real-time situational awareness during active incidents.",,,,,https://coloradosprings.gov/together-cos,,,,,,,,3/30/26,,,,,
03/30,Colorado Springs,Colorado ,,,,ALPR / License Plate Readers,License Plate Readers,Flock Safety,,Law Enforcement,Active ,Organizational Use ,"Flock Safety's Automated License Plate Readers scan license plates on streets and highways to help law enforcement catch criminal suspects, providing objective evidence for cases.",,,,,"https://www.atlasofsurveillance.org/search?location=Colorado+Springs,+CO",,,,,,,,3/30/26,,,,,
03/30,Colorado Springs,Colorado ,,,,Real-Time Crime / Fusion Centers,Accurint for Law Enforcement,LexisNexis,,Law Enforcement,Active ,Organizational Use ,"Accurint for Law Enforcement is a public records search platform that gives officers and investigators instant access to billions of records, including identities, addresses, assets, and criminal histories, to generate investigative leads and locate suspects.",,,,,"https://www.atlasofsurveillance.org/search?location=Colorado+Springs,+CO",,,,,,,,3/30/26,,,,,
03/30,Colorado Springs,Colorado ,,,,Drone Technology,Skydio X10,"Skydio, Inc.",,Law Enforcement,Active ,Organizational Use ,"The Skydio X10 is an AI-powered drone that provides law enforcement with real-time aerial surveillance and thermal imaging, deployable from patrol vehicles or remote dock stations to support active incidents.",,,,,https://krdo.com/news/2026/02/06/colorado-springs-police-unveil-new-technology-expected-to-improve-response-times/,,,,,,,,3/30/26,,,,,
03/30,Colorado Springs,Colorado ,,,,Drone Technology,Drone First Responder,DJI,,Law Enforcement,Active ,Organizational Use ,DJI's enterprise drones are deployed in Drone as First Responder programs to stream live aerial and thermal video to dispatchers before officers arrive on scene.,,,,,"https://www.atlasofsurveillance.org/search?location=Colorado+Springs,+CO",,,,,,,,3/30/26,,,,,
03/30,Colorado Springs,Colorado ,,,,Non-Emergency Dispatch Assistance,Prepared911,"Invictus Apps, Inc.",,Law Enforcement,Active ,Organizational Use ,"Prepared 911 is an AI platform that automatically triages non-emergency calls, transcribes radio communications, and provides real-time translation to reduce dispatcher workload and speed up emergency response.",,,,,https://www.koaa.com/news/covering-colorado/new-feature-allows-uccs-campus-police-to-access-student-phone-cameras,,,,,,,,3/30/26,,,,,
07/19,Omaha,Nebraska,Detection,,,Gun Detection Technology: Schools,ZeroEyes,ZeroEyes Inc. ,https://zeroeyes.com/?utm_feeditemid&utm_device=c&utm_term=zeroeyes%20inc&utm_source=google&utm_medium=ppc&utm_campaign=G%20%7C%20S%20%7C%20Brand_Exact%20%5BE%5D&hsa_cam=23233017744&hsa_grp=188529775419&hsa_mt=e&hsa_src=g&hsa_ad=783016424793&hsa_acc=9242229403&hsa_net=adwords&hsa_kw=zeroeyes%20inc&hsa_tgt=kwd-2009785924478&hsa_ver=3&gad_source=1&gad_campaignid=23233017744&gbraid=0AAAAACSzAtS8wdtAqOxVhCHNa8egStKmG&gclid=Cj0KCQjw4a3OBhCHARIsAChaqJPe1iJ-iVIcsOo2He-58x6E8l6DsnyP5nKQb6RozlVm6iAx5teselcaAm1cEALw_wcB,Law Enforcement,Active,Organizational Use,The ZeroEyes system uses advanced AI technology to identify potential firearms in camera footage. The alert is sent to the school's security staff for human verification. Praised for combination of AI and human verification to detect threats. ,www.3newsnow.com,,,,https://www.3newsnow.com/central-omaha/westside-community-schools-eyes-new-ai-tech-to-spot-weapons-on-campus#google_vignette,,,,"Hudson, M. (2024, May 10). Westside Community Schools eyes new AI tech to spot weapons on campus. KMTV 3 News Now Omaha. https://www.3newsnow.com/central-omaha/westside-community-schools-eyes-new-ai-tech-to-spot-weapons-on-campus#google_vignette",,,,11/10/25,5,0,0,5,Old RA's 
07/19,Omaha ,Nebraska ,Surveillance,Detection ,,Drone as First Responder Program ,Axon Air Skydio X10 docks ,"Axon Enterprise, Inc.",https://www.axon.com/,Law Enforcement,Active ,Organizational Use ,"The Omaha Police Department has launched a “Drones as First Responders” program using high-tech drones to arrive at certain 911 calls quickly, provide real-time aerial footage for situational awareness, enhance officer safety and improve response times, while not being used for general neighborhood surveillance. ",cityclerk.cityofomaha.org,,,,https://cityclerk.cityofomaha.org/wp-content/uploads/images/ORD-44387.pdf,,,,,,,,12/12/25,1,0,,,New RAs
03/26,Omaha,Nebraska,,,,Real-Time Crime / Fusion Centers,Axon Fusus,"Axon Enterprise, Inc.",https://www.axon.com/,Law Enforcement,Active ,Organizational Use ,"Axon Fusus is a camera integration platform that allows for businesses to integrate their security cameras with their local police department's precinct. This technology allows the Omaha Police Department to more efficiently catch criminals, as well as clear unsolved cases with the public's help.",www.ketv.com,,,,https://www.ketv.com/article/new-real-time-operations-center-meant-to-help-omaha-police-catch-crooks/63260557,,,,"Rob McCartney. (2024, December 23). New real-time operations center meant to help Omaha police catch crooks. KETV NewsWatch 7. https://www.ketv.com/article/new-real-time-operations-center-meant-to-help-omaha-police-catch-crooks/63260557",,,,3/26/26,5,0,,,
03/26,Omaha,Nebraska,,,,ALPR / License Plate Readers,Flock LPR Cameras ,Flock Safety,https://www.flocksafety.com/,Law Enforcement,Active ,Organizational Use ,"Flock Safety's Automated License Plate Readers read vehicle license plates and record vehicle data, allowing for scanned license plates to be checked against criminal databases. The Omaha Police Department utilizes this technology to solve cases more efficiently and effectively",www.3newsnow.com,,,,https://www.3newsnow.com/northwest-omaha/douglas-county-sheriffs-office-enters-new-contract-to-use-automatic-license-plate-reader-cameras,,,,"Lamkins, J. (2024, April 24). Douglas County Sheriff's Office enters new contract to use automatic license plate reader cameras. 3NewsNow (KMTV). https://www.3newsnow.com/northwest-omaha/douglas-county-sheriffs-office-enters-new-contract-to-use-automatic-license-plate-reader-cameras",,,,3/26/26,5,0,,,
03/26,Omaha,Nebraska,,,,Gun Detection,ShotSpotter,"SoundThinking, Inc.",https://www.soundthinking.com/,Law Enforcement,Active ,Organizational Use ,"ShotSpotter is an acoustic gunshot detection system that helps reduce response time to gunfire incidents, assists with evidence collection, and locates victims. The Omaha Police Department has utilized this tool to improve community safety and reduce gun related crimes.",www.soundthinking.com,,,,https://www.soundthinking.com/resource/omaha-police-department-leverages-shotspotter-to-improve-community-safety-since-2011/,,,,"SoundThinking, Inc. (n.d.). Omaha Police Department leverages ShotSpotter to improve community safety since 2011. SoundThinking. https://www.soundthinking.com/resource/omaha-police-department-leverages-shotspotter-to-improve-community-safety-since-2011/",,,,3/26/26,5,0,,,
03/26,Omaha,Nebraska,,,,AI-Assisted Police Reports / Body Cameras,Axon Body 3 / 4,"Axon Enterprise, Inc.",https://www.axon.com/,Law Enforcement,Active ,Organizational Use ,"Axon's Body Cameras allow for enhanced evidence capture and real-time situational awareness/support for law enforcement officers. These cameras are a part of the Omaha Police Department's Officer Safety Packages, ultimately improving safety and communication for both officers and civilians.",cityclerk.cityofomaha.org,,,,https://cityclerk.cityofomaha.org/wp-content/uploads/images/ORD-44622.pdf,,,,"City of Omaha. (2026, February 6). Ordinance No. 44622. https://cityclerk.cityofomaha.org/wp-content/uploads/images/ORD-44622.pdf",,,,3/26/26,5,0,,,
11/29,Miami,Florida,Surveillance,Detection ,Back End Administration,Autonomous Patrol Vehicle ,Police Unmanned Ground (PUG) Vehicle Patrol Partner ,Policing Lab,,Law Enforcement,Active,Organizational Use,"The PUG Patrol Partner is a patrolling vehicle with drone launch capabilities, containing real-time crime data, and a suite of sensors, including 360-degree cameras, thermal imaging, and license plate recognition. In Pilot stage until Oct. 2026.",www.just-auto.com,,,,https://www.just-auto.com/news/autonomous-police-patrol-vehicle-pilot-announced-in-us/?cf-view,https://futurism.com/advanced-transport/florida-police-car-pug,,,"Leggett, D. (2025, October 2). Autonomous police patrol vehicle pilot announced in US. Just Auto. https://www.just-auto.com/news/autonomous-police-patrol-vehicle-pilot-announced-in-us/?cf-view",,,,11/29/25,9,0,,,Old RA's 
08/13,Miami,Florida,Surveillance,Front End Support,Back End Administration,Police Cadet AI Assistant,Truleo AI,TRULEO ,http://truleo.co/,Law Enforcement,Active,Organizational Use,"The Truleo AI tools being used in police cadet training include the body camera footage review, which auto-flags specific verbal cues and events for departmental review, generate voice-dictated police reports, and receive real-time virtual dispatch guidance. ",www.miaminewtimes.com,,,,https://www.miaminewtimes.com/news/miami-dade-police-academy-adds-ai-training-for-future-officers-22997573,https://www.police1.com/police-products/police-technology/software/video-analysis/1st-police-training-facility-in-the-country-to-leverage-ai-assistants,https://en.cibercuba.com/noticias/2025-05-04-u1-e207888-s27061-nid302078-miami-lidera-futuro-formacion-policial-inteligencia#google_vignette,https://cbs4indy.com/business/press-releases/ein-presswire/805647447/1st-police-training-facility-in-the-country-to-leverage-ai-assistants/,"McLendon, B. S. (2025, May). Miami-Dade Police Academy Adds AI Training for Future Officers. Miami New Times. https://www.miaminewtimes.com/news/miami-dade-police-academy-adds-ai-training-for-future-officers-22997573",,,,11/29/25,9,0,0,8,Old RA's 
08/13,Miami,Florida,Detection,,,Gun Detection Technology,ShotSpotter,"SoundThinking, Inc.",https://www.soundthinking.com/,Law Enforcement,Active,Organizational Use,The ShotSpotter system uses acoustic sensors to detect and pinpoint the location of potential gunfire incidents.,www.aetv.com,,,,https://www.aetv.com/real-crime/artificial-intelligence-use-in-criminal-investigations,,,,"Alvarado, F. (2024, September 30). Artificial Intelligence Use in Criminal Investigations Gains Traction. A&E. https://www.aetv.com/real-crime/artificial-intelligence-use-in-criminal-investigations",,,,11/29/25,9,0,0,8,Old RA's 
08/13,Miami,Florida,Surveillance ,,,Facial Recognition Technology,Clearview AI 2.0,"Clearview AI, Inc. ",https://www.clearview.ai/,Law Enforcement,Active,Organizational Use,"Clearview AI provided a facial recognition technology where users can upload an image of a face, match it against their database, and then supply links to other online locations where the match can be found.",reason.com,,,,https://reason.com/2024/01/19/miami-police-used-clearview-ai-facial-recognition-in-arrest-of-homeless-man/,,,,"Ciaramella, C. J. (2024, January 19). Miami police used Clearview AI facial recognition in arrest of homeless man. Reason.com. https://reason.com/2024/01/19/miami-police-used-clearview-ai-facial-recognition-in-arrest-of-homeless-man/",,,,11/29/25,9,0,0,8,Old RA's 
08/13,Miami,Florida,Back End Administration,,,Legal Workflow Automation,CoCounsel,Thomson Reuters ,,Courts ,Active ,Organizational Use ,"The Miami-Dade County Public Defender’s Office in Florida is using an AI platform called CoCounsel to organize case information, help with legal research, build timelines, draft briefs and assemble reports across its heavy caseload. This AI assistance streamlines workflows and automates review of complex records, allowing staff to focus more on client-focused work.  ",www.govtech.com,,,,https://www.govtech.com/artificial-intelligence/florida-public-defender-taps-ai-to-tackle-files-other-work,,,,,,,,12/15/25,9,0,,,New RAs
08/13,Miami,Florida,Surveillance,,,Surveillance,Axon Fusus,"Axon Enterprise, Inc.",https://www.axon.com/,Law Enforcement,Active ,Organizational Use ,"In the Axon connected ecosystem used by Miami police, AI tools help integrate real-time 911 intelligence, live video feeds and data from cameras and sensors to improve situational awareness and community collaboration. ",www.police1.com,,,,https://www.police1.com/up-close-axons-connected-ecosystem-builds-community-collaboration,,,,,,,,12/15/25,9,0,,,New RAs
03/29,Miami,Florida,,,,ALPR / License Plate Readers,Flock LPR Cameras ,Flock Safety,https://www.flocksafety.com/,Law Enforcement,Active ,Organizational Use ,"Flock Safety's Automated License Plate Readers read vehicle license plates and record vehicle data, allowing for scanned license plates to be checked against criminal databases. The Miami Police use this technology to be alerted of vehicles linked to a wanted suspect, stolen vehicles, or endagered persons and overall enhance public safety and reduce crime.",ktul.com,,,,https://ktul.com/news/local/miami-police-to-install-license-plate-cameras-using-state-grant,,,,"KTUL Staff. (2026, January 5). Miami police to install license plate cameras using state grant. KTUL. https://ktul.com/news/local/miami-police-to-install-license-plate-cameras-using-state-grant",,,,3/29/26,9,0,,,
03/29,Miami,Florida,,,,Drone Technology,Skydio X10,"Skydio, Inc.",https://www.skydio.com/ ,Law Enforcement,Active ,Organizational Use ,"Skydio's Drone as First Responder program assists officers in enhancing speed, safety, and efficiency through providing live aerial intelligence. The Miami Beach Police Department uses these drones for traffic monitoring, accident reconstruction, and overwatch for large scale public events.",www.skydio.com,,,,https://www.skydio.com/blog/miami-beach-police-department-deploys-skydio-x10-as-first-responder-drones,,,,"Skydio. (2024, February 28). Miami Beach Police Department deploys Skydio X10 as first responder drones. Skydio. https://www.skydio.com/blog/miami-beach-police-department-deploys-skydio-x10-as-first-responder-drones",,,,3/29/26,9,0,,,
03/29,Miami,Florida,,,,AI-Assisted Police Reports / Body Cameras,Axon Body 3 / 4,"Axon Enterprise, Inc.",https://www.axon.com/,Law Enforcement,Active ,Organizational Use ,"Axon's Body Cameras allow for enhanced evidence capture and real-time situational awareness/support for law enforcement officers. The South Miami Police Department uses these cameras to reinforce accountability and transparency, specifically with the camera's real-time oversight capability. ",www.southmiamifl.gov,,,,https://www.southmiamifl.gov/m/newsflash/home/detail/373,,,,"City of South Miami. (2024, July 22). City of South Miami Police Department launches Project Lifesaver; welcomes first registrant. https://www.southmiamifl.gov/m/newsflash/home/detail/373",,,,3/29/26,9,0,,,
05/06,Virginia Beach,Virginia,Front End Support,,,Non-Emergency Dispatch Assistance ,Amazon Connect,Amazon Web Services,,Law Enforcement,Active,Organizational Use,"Amazon Connect greets callers to the city’s non-emergency number, uses voice-response and natural-language processing to understand the caller’s intent, then either routes the call to a human agent, transfers to another city department, or provides automated service/links, which allows live dispatchers to focus on true emergencies.",www.wtkr.com,,,,https://www.wtkr.com/news/in-the-community/virginia-beach/artificial-inteligence-is-now-helping-911-dispatchers-in-virginia-beach,https://virginiabeach.gov/connect/blog/virginia-beach-non-emergency-line-to-get-help-with-ai-powered-amazon-connect,https://virginiabeach.gov/connect/blog/award-winning-non-emergency-call-routing-system-reduces-hold-times-prioritizes-emergency-calls,,"Hood, J. (2024, May 13). Artificial intelligence is now helping 911 dispatchers in Virginia Beach. News3WTKR. https://www.wtkr.com/news/in-the-community/virginia-beach/artificial-inteligence-is-now-helping-911-dispatchers-in-virginia-beach",,,,11/1/25,7,0,0,7,Old RA's 
05/06,Virginia Beach,Virginia,Forensic Analysis,,,Facial Recognition Technology ,Clearview AI,"Clearview AI, Inc. ",https://www.clearview.ai/,Law Enforcement,Inactive,Organizational Use,"Clearview AI lets detectives upload a photo of an unknown person and search a massive database of online images scraped from social media and other websites to find possible matches, thereby generating investigative leads in criminal cases.",www.govtech.com,,,,https://www.govtech.com/security/Facial-Recognition-Was-Used-in-Virginia-Beach-Police-Now-Say.html,https://www.securityindustry.org/2022/03/15/virginias-new-rules-for-facial-recognition-and-what-they-mean/,https://www.pilotonline.com/2021/03/30/virginia-state-police-admit-after-repeated-denials-that-they-used-controversial-facial-recognition-app/,https://apnews.com/article/technology-criminal-investigations-virginia-virginia-beach-a055525f5ffd6ad63ce115961b96180c,"Edwards, J. (2021, March 12). Facial recognition was used in Virginia Beach, police now say. Government Technology. https://www.govtech.com/security/facial-recognition-was-used-in-virginia-beach-police-now-say.html",,,,11/1/25,7,0,0,7,Old RA's 
