06/24,San Jose,California,Detection,,,Gun Detection Technology,Flock Safety Raven ,Flock Safety,https://www.flocksafety.com/,Law Enforcement,Active,Organizational Use,"The San Jose Police Department may use gunshot detection systems to enhance its ability to respond to potential firearm crimes. These systems can identify the time, location, and associated vehicles surrounding a firearm incident. ",www.wired.com,,,,https://www.wired.com/story/ai-gunshot-detection-accuracy-san-jose-nyc//,https://www.sanjoseca.gov/your-government/departments-offices/information-technology/digital-privacy/ai-reviews-algorithm-register,,,"Feathers, T. (2024, June 25). The Mystery of AI Gunshot-Detection Accuracy Is Finally Unraveling. WIRED. https://www.wired.com/story/ai-gunshot-detection-accuracy-san-jose-nyc/",,,,11/17/25,8,0,0,8,Old RA's 
06/24,San Jose,California,Detection ,,,Automated License Plate Recognition,Flock LPR Cameras ,Flock Safety ,https://www.flocksafety.com/,Law Enforcement,Active,Organizational Use,"Over 500 Flock Safety automated license plate readers have been installed throughout San Jose, which take a picture of the back of a car to identify the make, model, color, and license plate characters. ",www.sanjoseca.gov,,,,https://www.sanjoseca.gov/your-government/departments-offices/information-technology/digital-privacy/ai-reviews-algorithm-register,,,,City of San José. (2023). Artificial Intelligence & Inventory. Sanjoseca.gov. https://www.sanjoseca.gov/your-government/departments-offices/information-technology/digital-privacy/ai-reviews-algorithm-register,,,,11/17/25,8,0,0,8,Old RA's 
06/24,San Jose,California,Forensic Analysis,,,Vision-based Traffic Collection,Road Safety Conditions Pilot,Currux Vision ,,Law Enforcement,Active,Organizational Use,"The Road Safety Conditions Pilot uses AI and computer vision to proactively detect obstructions in and aaround bike lanes and sidewalks, automatically reporting them to the relevant city department. ",www.sanjoseca.gov,,,,https://www.sanjoseca.gov/your-government/departments-offices/information-technology/digital-privacy/data-usage-policies-public-comment,,,,City of San José. (2023). Artificial Intelligence & Inventory. Sanjoseca.gov. https://www.sanjoseca.gov/your-government/departments-offices/information-technology/digital-privacy/ai-reviews-algorithm-register,,,,11/17/25,8,0,0,8,Old RA's 
06/24,San Jose,California,Detection ,,,AI Red Light Running Cameras,Verra Mobility Red-Light Enforcement,Verra Mobility ,,Law Enforcement,Active,Organizational Use,San Jose implemented an automated red light camera pilot program to capture photos of vehicles that illegally run red lights. ,www.sanjoseca.gov,,,,https://www.sanjoseca.gov/your-government/departments-offices/information-technology/digital-privacy/ai-reviews-algorithm-register,,,,City of San José. (2023). Artificial Intelligence & Inventory. Sanjoseca.gov. https://www.sanjoseca.gov/your-government/departments-offices/information-technology/digital-privacy/ai-reviews-algorithm-register,,,,11/17/25,8,0,0,8,Old RA's 
06/24,San Jose ,California,,,,Vision-Based Traffic Safety Analytics,Intelligent Transportation System (ITS),Currux Vision,,Law Enforcement,Active,Organizational Use ,"Currux Vision’s AI-based Intelligent Transportation System uses camera-driven edge computing to monitor and analyze traffic conditions in real time, enabling automated alerts and data collection to improve traffic operations and safety. The system supports collision review by measuring violations, traffic patterns, and congestion at intersections, allowing city engineers to evaluate safety conditions and the effectiveness of roadway improvements.",www.sanjoseca.gov,,,,https://www.sanjoseca.gov/your-government/departments-offices/information-technology/digital-privacy/ai-reviews-algorithm-register,,,,Artificial Intelligence & Inventory. (n.d.). City of San Jose. https://www.sanjoseca.gov/your-government/departments-offices/information-technology/digital-privacy/ai-reviews-algorithm-register,,,,11/13/25,5,0,,,New RAs
06/24,San Jose ,California,,,,Gunshot Detection System (Pilot),FususONE,"Axon Enterprise, Inc.",https://www.axon.com/,Law Enforcement,Active,Organizational Use ,"Axon Fusus is a real-time intelligence platform that integrates video feeds and sensor data from public, private, and city-owned sources into a single, cloud-based operational interface. The technology provides a unified, real-time view of incidents to enhance situational awareness and support coordinated public safety response.",www.sanjoseca.gov,,,,https://www.sanjoseca.gov/your-government/departments-offices/information-technology/digital-privacy/ai-reviews-algorithm-register,,,,Artificial Intelligence & Inventory. (n.d.). City of San Jose. https://www.sanjoseca.gov/your-government/departments-offices/information-technology/digital-privacy/ai-reviews-algorithm-register,,,,11/13/25,5,0,,,New RAs
06/24,San Jose ,California,,,,"non-emergency police reports via voice, mobile, web, and text",Amazon Connect,Amazon Web Services,,Law Enforcement,Active ,Organizational Use ,"Amazon Connect is an AI-enabled call-handling platform, to automatically answer and triage non-emergency police calls. The system applies AI-driven speech analysis and call classification to reduce dispatcher workload and improve response efficiency without replacing human staff.",www.police1.com,,,,https://www.police1.com/artificial-intelligence/ai-based-dispatch-a-game-changer-in-public-safety-agencies,,,,"Pierce, L. B. (2025, April 17). AI-based dispatch: A game changer in public safety agencies. Police1. https://www.police1.com/artificial-intelligence/ai-based-dispatch-a-game-changer-in-public-safety-agencies",,,,11/13/25,5,0,,,New RAs
06/24,San Jose ,California,,,,Generative AI for Case Ciatation (hallucination),Claude,Anthropic,,Courts ,Inactive,Individual Use,"Claude is an AI language model developed by Anthropic that is used to generate, analyze, and summarize text to support a wide range of research, writing, and analytical tasks.",www.reuters.com,,,,https://www.reuters.com/legal/litigation/anthropic-expert-accused-using-ai-fabricated-source-copyright-case-2025-05-13/,,,,"Brittain, B. (2025, May 13). Anthropic expert accused of using AI-fabricated source in copyright case. Reuters. https://www.reuters.com/legal/litigation/anthropic-expert-accused-using-ai-fabricated-source-copyright-case-2025-05-13/",,,,11/13/25,5,0,,,New RAs
03/25,San Jose,California,,,,Object detection,N/A,Toyota Mobility Foundation,,Law Enforcement,Unsure,Organizational Use ,"This device detects hazards on the street such as potholes, illegal dumping, etc., and reports this to law enforcement. ",statescoop.com,,,,https://statescoop.com/san-jose-california-ai-streets-pilot-projects/,,,,"Foxsowell, S. (2026, February 6). San Jose, California, reports success with AI-powered streets pilot projects. StateScoop. https://statescoop.com/san-jose-california-ai-streets-pilot-projects/",,,,3/25/26,8,0,,,
03/25,San Jose,California,,,,Body Camera,Body Camera Program,"Axon Enterprise, Inc.",https://www.axon.com/,Law Enforcement,Active ,Organizational Use ,The body camera is used as an evidence-gathering technology to capture live video feed. ,localnewsmatters.org,,,,https://localnewsmatters.org/2025/10/28/san-jose-approves-expanded-taser-body-cam-deal-with-axon-despite-monopoly-concerns/,,,,"Menconi, K. (2025, October 28). San Jose approves expanded taser, body cam deal with axon despite monopoly concerns. Local News Matters. https://localnewsmatters.org/2025/10/28/san-jose-approves-expanded-taser-body-cam-deal-with-axon-despite-monopoly-concerns/",,,,3/25/26,8,0,,,
03/25,San Jose,California,,,,Disaster detection,N/A,Ladris Technologies,,Law Enforcement,Active ,Organizational Use ,"This device is used to detect disasters ranging from wildfires to mass shootings, allowing for the preparatio of an emergency plan.",www.sfgate.com,,,,https://www.sfgate.com/news/bayarea/article/san-jose-spotlight-san-jose-adds-ai-tools-to-its-21267681.php,,,,"Bay City News Service. (2025, December 29). San Jose Spotlight: San Jose Adds Ai Tools To Its Disaster Tactics. SFGate. https://www.sfgate.com/news/bayarea/article/san-jose-spotlight-san-jose-adds-ai-tools-to-its-21267681.php",,,,3/25/26,8,0,,,
03/25,San Jose ,California ,,,,Camera,AxonFusus,"Axon Enterprise, Inc.",https://www.axon.com/,Law Enforcement,Active ,Organizational Use ,"The RTIC uses Axon cameras to scan license plates,  surveil neighborhoods, and provide live video feed. ",www.axon.com,,,,https://www.axon.com/newsroom/customer-story/more-than-eyes-on-the-street-san-jose,,,,Axon. (n.d.). More than eyes on the street: San Jose’s vision for real-time public safety. Axon.com. https://www.axon.com/newsroom/customer-story/more-than-eyes-on-the-street-san-jose,,,,3/25/26,5,0,,,
05/20,Austin,Texas,Front End Support,,,Non-Emergency Dispatch Assistance ,Case Service Reporting,Versaterm,https://www.versaterm.com/,Law Enforcement,Active,Organizational ,N/A,www.foxnews.com,,,,https://www.foxnews.com/us/austin-police-department-turns-ai-staffing-crisis-looms?msockid=327f2def87f6614b33a7397586f260c8,https://www.texasstandard.org/stories/ai-artificial-intelligence-advisory-council-texas-greg-abbott-house-bill-hb-2060/,https://www.youtube.com/watch?v=lTcLPpxUc0Y,https://www.kvue.com/article/news/police/austin-police-ai-non-emergency-reporting/269-2d3eb69c-b46d-4de0-8db5-9a535135ebcb,"Wehner, G. (2023, March 3). Austin Police Department turns to AI as staffing crisis looms. Fox News. https://www.foxnews.com/us/austin-police-department-turns-ai-staffing-crisis-looms?msockid=327f2def87f6614b33a7397586f260c8","Nabil Remadna. (2022, February 9). APD hopes artificial intelligence can help with staff shortages at 911 center. KXAN Austin. https://www.kxan.com/news/local/austin/apd-hopes-artificial-intelligence-can-help-with-staff-shortages-at-911-center/",,,10/23/25,4,0,0,4,Old RA's 
08/22,Austin,Texas,Surveillance,,,Facial Recognition Technology ,N/A,"Clearview AI, Inc. ",https://www.clearview.ai/,Law Enforcement,Active,Organizational Use,Clearview AI is a facial recognition company that collects and analyzes images from the internet to help law enforcement identify individuals by matching faces to a massive online photo database.,www.grassrootsleadership.org,,,,https://www.grassrootsleadership.org/press-releases/civil-rights-groups-call-for-austin-to-ban-law-enforcements-use-of-facial-recognition-software,https://pulitzercenter.org/stories/texas-ai-powered-surveillance-arsenal-has-ballooned-proposed-laws-provide-few-guardrails,City memo: Austin police used facial recognition technology to identify crime suspect,,"Grassroots Leadership (2021, April 7). Civil rights groups call for Austin to ban law enforcement’s use of facial recognition software. www.grassrootsleadership.org/press-releases/civil-rights-groups-call-for-austin-to-ban-law-enforcements-use-of-facial-recognition-software. ","D’Annunzio , Francesca. “Texas’ AI-Powered Surveillance Arsenal Has Ballooned. Proposed Laws Provide Few Guardrails.” Pulitzer Center, 2025, pulitzercenter.org/stories/texas-ai-powered-surveillance-arsenal-has-ballooned-proposed-laws-provide-few-guardrails.","Pauda, Erica. “Memo: APD Used Facial Recognition Technology to Identify Robbery, Assault Suspect.” KXAN Austin, 28 Apr. 2025, www.kxan.com/news/local/austin/memo-apd-used-facial-recognition-technology-to-identify-robbery-assault-suspect/.",,10/23/25,4,0,0,4,Old RA's 
06/21,Austin,Texas,Detection,,,Automated License Plate Recognition,N/A,"Axon Enterprise, Inc.",https://www.axon.com/,Law Enforcement,Inactive,Organizational Use,"Flock Safety provides fixed and vehicle-mounted cameras that automatically capture license plate images and convert them to searchable data. The system can alert law enforcement when a plate matches hot lists or ongoing investigations. Axon integrates ALPR technology into body-worn and in-car camera systems, enabling real-time plate recognition and data sharing across agencies.",www.kvue.com,,,,https://www.kvue.com/article/news/local/austin-license-plate-readers-ends-privacy-concerns/269-4dc64690-c6c0-4ace-a009-fd8a13f69113,Texas authorizes license plate scanning company serving Houston,,,"Sanchez, K. (2025, June 4). Austin Pulls the Plug on Automatic License Plate Readers amid Privacy Concerns. KVUE, www.kvue.com/article/news/local/austin-license-plate-readers-ends-privacy-concerns/269-4dc64690-c6c0-4ace-a009-fd8a13f69113. ",DPS Tangles contract 2:18:2025. (2025). Documentcloud.org. https://www.documentcloud.org/documents/25870552-dps-tangles-contract-2182025/,,,10/23/25,4,0,0,4,Old RA's 
05/20,Austin ,Texas,,,,"non-emergency police reports via voice, mobile, web, and text",Case Service Reporting,Versaterm,https://www.versaterm.com/,Law Enforcement,Active ,Organizational Use ,"The Austin Police Department uses Versaterm Public Safety’s Case Service, an AI software, for the intake of non-emergency police reports. Case Service communicates with the public through to ask questions and fill out non-emergency reports.",www.domesticpreparedness.com,,,,https://www.domesticpreparedness.com/articles/ai-partners-filling-law-enforcement-experience-gaps/,,,,"Henderson, J. (2023, July 26). AI Partners – Filling Law Enforcement Experience Gaps - Domestic Preparedness. Domestic Preparedness. https://www.domesticpreparedness.com/articles/ai-partners-filling-law-enforcement-experience-gaps/",,,,11/6/25,2,0,,,New RAs
05/20,Austin ,Texas,,,,Facial-recognition software,Clearview AI,"Clearview AI, Inc. ",https://www.clearview.ai/,Law Enforcement,Active ,Organizational Use ,"The Austin Police Department has used Clearview AI, which searches a database of over 40 billion public images, to generate investigative leads.",www.kxan.com,,,,https://www.kxan.com/news/local/austin/memo-apd-used-facial-recognition-technology-to-identify-robbery-assault-suspect/,,,,"Pauda, E. (2025, April 28). Memo: APD used facial recognition technology to identify robbery, assault suspect. KXAN Austin. https://www.kxan.com/news/local/austin/memo-apd-used-facial-recognition-technology-to-identify-robbery-assault-suspect/",,,,11/6/25,2,0,,,New RAs
03/27,Austin,Texas,,,,Body camera,Body Camera ,"Axon Enterprise, Inc.",https://www.axon.com/,Law Enforcement,Active ,Organizational Use ,The Axon Body Cameras are used by police officers to record videos as a digital evidence management tool.,investor.axon.com,,,,https://investor.axon.com/2017-04-13-Austin-Police-Department-Secures-724-Axon-Body-Cameras-and-Unlimited-Data-Storage-on-Evidence-com,,,,"Axon. (2017, April 13.). Austin police department secures 724 axon body cameras and unlimited data storage on Evidence.com. Axon IR. https://investor.axon.com/2017-04-13-Austin-Police-Department-Secures-724-Axon-Body-Cameras-and-Unlimited-Data-Storage-on-Evidence-com",,,,3/27/26,4,0,,,
09/04,Charlotte,North Carolina,Detection ,,,Gun Detection Technology,Shotspotter,"SoundThinking, Inc.",https://www.soundthinking.com/,Law Enforcement,Active,Organizational Use,"ShotSpotter is an acoustic gunshot detection system that alerts police to 
virtually all gunfire within a coverage area in less than 60 seconds, helping reduce police response times to gun crimes and save lives.",www.wfae.org,,,,https://www.wfae.org/business/2025-01-21/company-behind-shotspotter-defends-it-despite-several-nc-cities-dropping-the-technology,,,,"Terry, M. (2025, Jan 21). Company behind ShotSpotter defends it despite several NC cities dropping the technology. WFAE. https://www.wfae.org/business/2025-01-21/company-behind-shotspotter-defends-it-despite-several-nc-cities-dropping-the-technology ",,,,10/27/25,4,0,0,4,Old RA's 
09/04,Charlotte ,North Carolina,,,,License plate reader ,"""HeadsUp"" ",Acusensus,,Law Enforcement,Active ,Organizational Use ,"The device takes ""numerous pictures of the passing commercial motor vehicle's license plate and truck cabin before sending the photos to law enforcement, who are alerted to any violations like distracted driving or driving without a seatbelt"" ",www.foxnews.com,,,,https://www.foxnews.com/tech/north-carolina-law-enforcement-using-ai-combat-increase-distracted-drivers,,,,,,,,2/11/26,1,0,,,
03/27,Charlotte,North Carolina,,,,Facial recognition tool ,N/A,"Clearview AI, Inc. ",https://www.clearview.ai/,Law Enforcement,Active ,Organizational Use ,The facial recognition tool is used to capture photos of people and cross reference them with social media accounts to identify suspects.,www.govtech.com,,,,https://www.govtech.com/public-safety/nc-police-have-secretly-been-using-clearview-ai-tech.html,,,,"Dukes, T. (2021, April 7). NC police have secretly been using Clearview AI tech. GovTech. https://www.govtech.com/public-safety/nc-police-have-secretly-been-using-clearview-ai-tech.html",,,,3/27/26,4,0,,,
03/27,Charlotte,North Carolina,,,,Body camera ,Body camera,"Axon Enterprise, Inc.",https://www.axon.com/,Law Enforcement,Active ,Organizational Use ,The Axon Body Cameras are used by police officers to record videos as a digital evidence management tool.,investor.axon.com,,,,"https://investor.axon.com/2015-03-31-Charlotte-Deploys-1,400-AXON-Body-Cameras-on-EVIDENCE-com-Ultimate-Plan",,,,"Axon. (2015, March 31). Charlotte deploys 1,400 AXON body cameras on EVIDENCE.com 'Ultimate' plan. Axon IR. https://investor.axon.com/2015-03-31-Charlotte-Deploys-1,400-AXON-Body-Cameras-on-EVIDENCE-com-Ultimate-Plan",,,,3/27/26,4,0,,,
03/27,Charlotte,North Carolina,,,,Traffic camera ,Flock LPR Cameras ,Flock Safety ,https://www.flocksafety.com/,Law Enforcement,Active ,Organizational Use ,The traffic cameras are used by law enforcement to record footage of accidents and traffic violations and gather evidence. ,thelitigator.com,,,,https://thelitigator.com/blog/charlotte-nc-traffic-cameras/,,,,"Taylor, J. E. (2025, July 19). Understanding Traffic Cameras in Charlotte, North Carolina. Taylor and Serbin Injury Lawyers. https://thelitigator.com/blog/charlotte-nc-traffic-cameras/",,,,3/27/26,4,0,,,
06/25,Columbus,Ohio,Detection ,,,Gun Detection Technology,ShotSpotter,"SoundThinking, Inc.",https://www.soundthinking.com/,Law Enforcement,Active,Organizational Use,"ShotSpotter is an acoustic gunshot detection system that alerts police to 
virtually all gunfire within a coverage area in less than 60 seconds, helping reduce police response times to gun crimes and save lives.",spectrumnews1.com,,,,https://spectrumnews1.com/oh/columbus/news/2025/05/02/police-cracking-down-on-gun-crimes-with-ai-technology--activists-raise-concerns,,,,"Elzie, S. (2025, May 15) Police cracking down on gun crimes with AI technology, activists raise concerns. Spectrum News 1. https://spectrumnews1.com/oh/columbus/news/2025/05/02/police-cracking-down-on-gun-crimes-with-ai-technology--activists-raise-concerns",,,,11/1/25,3,0,0,3,Old RA's 
06/25,Columbus ,Ohio,,,,Drones,Skydio X10,"Skydio, Inc.",https://www.skydio.com/ ,Law Enforcement,Active ,Organizational Use ,"Two new Sydio X10 drones are being used to improeve the surveillance of the Columbus Police Department with their 360-degree sensory technology, thermal imaging, and ability to work without much light.",www.nucamp.co,,,,https://www.nucamp.co/blog/this-months-latest-tech-news-in-columbus-oh--thursday-july-31st-2025-edition,,,,"Ludo Fourrage. “This Month’s Latest Tech News in Columbus, OH - Thursday July 31st 2025 Edition.” Nucamp, Nucamp Bootcamp, 27 July 2025, www.nucamp.co/blog/this-months-latest-tech-news-in-columbus-oh--thursday-july-31st-2025-edition. Accessed 15 Oct. 2025.",,,,10/15/25,2,0,,,New RAs
06/25,Columbus ,Ohio,,,,Search Analytics,Gemini,Google,https://gemini.google.com/,Courts ,Active ,Individual Use ,Gemini is used to track data to see how clients search for lawyers in order to improve the marketing efficiency of law firms in Columbus.,www.milemarkmedia.com,,,,https://www.milemarkmedia.com/ohio-law-firm-ai-marketing/,,,,"“MileMark Legal Marketing.” MileMark Legal Marketing, 2025, www.milemarkmedia.com/ohio-law-firm-ai-marketing/. Accessed 19 Oct. 2025.",,,,10/15/25,2,0,,,New RAs
03/27,Columbus,Ohio,,,,Facial recognition tool ,N/A,"Clearview AI, Inc. ",https://www.clearview.ai/,Law Enforcement,Active ,Organizational Use ,The facial recognition tool is used to capture photos of people and cross reference them with social media accounts to identify suspects.,www.wosu.org,,,,https://www.wosu.org/politics-government/2025-04-02/ohio-police-use-robots-drones-and-ai-to-help-fight-crime-some-say-this-will-erode-privacy,,,,"Shillcock, G. (2025, April 2). Ohio police use robots, drones and AI to help fight crime. Some say this will erode privacy. WOSU Public Media. https://www.wosu.org/politics-government/2025-04-02/ohio-police-use-robots-drones-and-ai-to-help-fight-crime-some-say-this-will-erode-privacy",,,,3/27/26,3,0,,,
03/27,Columbus,Ohio,,,,License plate reader ,Flock LPR Cameras ,Flock Safety ,https://www.flocksafety.com/,Law Enforcement,Active ,Organizational Use ,The license plate reader is used to target high crime areas and surveil cars for evidence in investigations.,hoodline.com,,,,https://hoodline.com/2026/03/columbus-sticks-with-flock-cameras-as-ice-fears-boil-over/,,,,"Fisher, L. (2026, March 2). Columbus Sticks With Flock Cameras as ICE Fears Boil Over. Hoodline. https://hoodline.com/2026/03/columbus-sticks-with-flock-cameras-as-ice-fears-boil-over/",,,,3/27/26,3,0,,,
06/18,Indianapolis,Indiana,Detection,,,Gun Detection Technology,ShotSpotter,"SoundThinking, Inc.",https://www.soundthinking.com/,Law Enforcement,Inactive,Organizational Use,"ShotSpotter is an acoustic gunshot detection system that alerts police to 
virtually all gunfire within a coverage area in less than 60 seconds, helping reduce police response times to gun crimes and save lives.",www.indystar.com,,,,https://www.indystar.com/story/news/crime/2024/03/28/indianapolis-crime-city-will-not-implement-gunshot-detection-program/73130371007/?gnt-cfr=1&gca-cat=p&gca-uir=true&gca-epti=z114028e007400v114028b0045xxd004565&gca-ft=160&gca-ds=sophi,Report: Leaked data shows where gunshot sensors are in Indianapolis,,,"Nelson, S. (2024, March 24). IMPD will not go ahead with gunshot detection system. Indianapolis Star. https://www.indystar.com/story/news/crime/2024/03/28/indianapolis-crime-city-will-not-implement-gunshot-detection-program/73130371007/?gnt-cfr=1&gca-cat=p&gca-uir=true&gca-epti=z114028e007400v114028b0045xxd004565&gca-ft=160&gca-ds=sophi","Nelson, S. (2024, February 23). Leaked data shows where gunshot detectors are in Indy. Here’s where. The Indianapolis Star; Indianapolis Star. https://www.indystar.com/story/news/crime/2024/02/23/report-leaked-data-shows-where-gunshot-sensors-are-in-indianapolis-shotspotter-soundthinking-wired/72712639007/",,,10/27/25,4,0,0,3,Old RA's 
06/18,Indianapolis,Indiana,Forensic Analysis ,,,Case Cataloguing ,,,,Law Enforcement,Unsure,Organizational ,N/A,www.indystar.com,,,,https://www.indystar.com/story/news/crime/2024/08/28/ai-pilot-program-partnering-with-indianapolis-impd-police-dept-to-work-cold-case/74077146007/ ,,,,"Jackson, J. (2024, August 28). Cracking a cold case with AI? Tech volunteers try to solve an IMPD investigation. The Indianapolis Star; Indianapolis Star. https://www.indystar.com/story/news/crime/2024/08/28/ai-pilot-program-partnering-with-indianapolis-impd-police-dept-to-work-cold-case/74077146007/",,,,10/27/25,4,0,0,3,Old RA's 
06/18,Indianapolis,Indiana,Back End Administration,,,Large Language Models,ChatGPT,OpenAI,,Courts ,Active ,Individual Use ,"In Indianapolis, a lawyer filed a brief containing fictitious case citations, apparently produced by a paralegal. The judge noted these “hallucinated” cases were likely created by AI tools, though that wasn’t proven. The court ruled the key issue wasn’t AI use itself but the attorney’s failure to verify citations, imposing a $7,500 sanction and recommending disciplinary action.",naturalandartificiallaw.com,,,,https://naturalandartificiallaw.com/weekly-ai-hallucinations-1-7-sep-2025/,,,,,,,,10/30/25,4,0,,,New RAs
04/01,Indianapolis,Indiana,,,,License Plate Readers,ALPR ,Flock Safety,,Law Enforcement,Active ,Organizational Use ,"Flock Safety's License Plate Readers use AI image recognition and matching capabilities to match license plates read through devices with suspect license plates, leading to supposed recovery of stolen vehicles and criminal arrests.",,,,,https://fox59.com/news/indycrime/impd-uses-flock-cameras-to-help-solve-crimes/,,,,"Miller, D. (2025, November 10). IMPD uses FLOCK cameras to help solve crimes. Fox 59. https://fox59.com/news/indycrime/impd-uses-flock-cameras-to-help-solve-crimes/",,,,4/1,,,,,
04/30,San Francisco,California,Surveillance,,,Mobile Security Units,Mobile Surveillance Units,LiveView Technologies,,Law Enforcement,Active,Organizational Use,"These mobile surveillance units are structured as three cameras mounted on a 22-foot mast, that can be easily transported to new locations, equipped with thermal imaging features as well as floodlights, strobes and speakers for broadcasting warnings. ",www.lvt.com,,,,https://www.lvt.com/blog/ai-in-the-fight-against-crime-how-san-francisco-is-using-tech-to-stay-safe,https://www.youtube.com/watch?v=9GZF92tHp5Y,https://www.ktvu.com/news/sf-deploys-new-mobile-surveillance-cameras,https://www.foxnews.com/tech/san-francisco-rolls-out-ai-powered-cameras-combat-crime,"Jackman, S. (2024, October 4). AI in the Fight Against Crime: How San Francisco is Using Tech to Stay Safe. LiveView Technologies. https://www.lvt.com/blog/ai-in-the-fight-against-crime-how-san-francisco-is-using-tech-to-stay-safe",,,,11/9/25,7,0,1,6,Old RA's 
