07/31,Corpus Christi,Texas,,,,AI-powered gun detection on surveillance cameras to identify firearms,ZeroEyes,ZeroEyes Inc. ,https://zeroeyes.com/?utm_feeditemid&utm_device=c&utm_term=zeroeyes%20inc&utm_source=google&utm_medium=ppc&utm_campaign=G%20%7C%20S%20%7C%20Brand_Exact%20%5BE%5D&hsa_cam=23233017744&hsa_grp=188529775419&hsa_mt=e&hsa_src=g&hsa_ad=783016424793&hsa_acc=9242229403&hsa_net=adwords&hsa_kw=zeroeyes%20inc&hsa_tgt=kwd-2009785924478&hsa_ver=3&gad_source=1&gad_campaignid=23233017744&gbraid=0AAAAACSzAtS8wdtAqOxVhCHNa8egStKmG&gclid=Cj0KCQjw4a3OBhCHARIsAChaqJPe1iJ-iVIcsOo2He-58x6E8l6DsnyP5nKQb6RozlVm6iAx5teselcaAm1cEALw_wcB,Law Enforcement,Active ,Organizational Use ,ZeroEyes uses AI to detect firearms on existing surveillance cameras and alert security personnel when a gun is identified.,editions.mydigitalpublication.com,,,,https://editions.mydigitalpublication.com/article/AI+in+Law+Enforcement/4720319/814464/article.html,https://www.kens5.com/article/news/local/zeroeyes-ai-platform-school-security-gun-detection-school-shooting-prevention/273-4c0544ad-487b-450c-8212-72effbd247eb,,,,,,,2/4/2026,4,0,,,
07/31,Corpus Christi,Texas,,,,"Mapping application with real-time traffic/weather data, floor plans, multi-user collaboration for emergency response planning/briefings (e.g., gas leak)",SituMap,Developed by TAMU-CC professor Richard Smith,,Law Enforcement,Active ,Organizational Use ,"SituMap is a mapping application developed by TAMU-CC professor Richard Smith that integrates real-time traffic and weather data, floor plans, and multi-user collaboration to support emergency response planning and briefings.",statetechmagazine.com,,,,https://statetechmagazine.com/article/2015/02/university-professor-develops-mapping-app-public-safety,,,,,,,,2/4/2026,4,0,,,
04/08,Corpus Christi,Texas,,,,Licnese plate readers ,License plate readers ,Flock Safety,,Law Enforcement,Active ,Organizational Use ,Mall owners send this data to law enforcement to prevent retail thefts involving vehicles. ,,,,,https://www.kristv.com/news/local-news/in-your-neighborhood/corpus-christi/theft-prevention-technology-added-at-the-shops-at-la-palmera,,,,"Scott, A. (2023, December 6). Theft prevention technology added at the shops at la Palmera. KRIS 6 News Corpus Christi. https://www.kristv.com/news/local-news/in-your-neighborhood/corpus-christi/theft-prevention-technology-added-at-the-shops-at-la-palmera",,,,4/8/26,,,,,
09/13,Newark,New Jersey,Surveillance,Back End Administration,,Data Analytics Platform: Monitor Officer Behavior,Watson,IBM,,Law Enforcement,Unsure,Organizational Use,"NJII's Public Safety branch has been given access to Watson, an AI platform that uses natural language processing to solve problems and conduct experiments related to machine learning. ",www.njii.com,,,,https://www.njii.com/2023/08/njii-defense-division-blog-post-1/, ,,,"McSweeney, J. (2023, August 29) NJII Defense: Enhancing Police BodyCam Technology with AI. https://www.njii.com/2023/08/njii-defense-division-blog-post-1/ ",, ,,2/1/2026,4,0,,,
09/13,Newark,New Jersey,Surveillance ,,,Facial Recognition Technology + Automated License Plate Recognition,N/A,Turn-key Technologies,,Law Enforcement,Active,Organizational Use,"Over 7,000 surveillance cameras employing AI were installed in 63 schools in Newark before the 2024 school year. These have the capability for facial recognition and license plate reading, with sensors that detect vape, gun sounds, and other abnormal noises. ",www.chalkbeat.org,,,,https://www.chalkbeat.org/newark/2024/05/03/board-of-education-approves-12-million-contract-to-install-artificial-intelligence-cameras/ ,, ,,"Rickman, R. (2024, May 14). Artificial intelligence surveillance coming to NJ’s largest school district. https://nj1015.com/artificial-intelligence-surveillance-newark-nj-schools-cameras/","Gomez, J. (2024, May 3). Newark Public School awards $12M contract for new AI camera system aimed at keeping schools safe. Chalkbeat. https://www.chalkbeat.org/newark/2024/05/03/board-of-education-approves-12-million-contract-to-install-artificial-intelligence-cameras/",, ,2/1/2026,4,0,,,
04/08,Newark,New Jersey,,,,Drone Technology ,Skydio X10 ,"Skydio, Inc. ",,Law Enforcement,Active ,Organizational Use ,This drone technology is used to help Newark's law enforcement and first responders respond to emergencies. ,,,,,https://www.youtube.com/watch?v=yw78YoTwuWY,,,,"Newark NJ Department Public Safety. (2025, December 23). Newark Police Launch Drone as First Responder Program to Enhance Public Safety. YouTube. https://www.youtube.com/watch?v=yw78YoTwuWY",,,,4/8/26,,,,,
04/08,Newark,New Jersey,,,,Body Camera,Axon Body ,"Axon Enterprise, Inc. ",,Law Enforcement,Active ,Organizational Use ,This camera records visuals when an officer takes out their gun and provides a sensor. ,,,,,https://www.newarkpostonline.com/news/newark-signs-3-8-million-10-year-deal-for-body-cams-and-other-police-equipment/article_12fbbed2-6519-11ef-8e38-dffece1c9636.html,,,,"Shannon, J. (2024, August 30). Newark signs $3.8 million, 10-year deal for body cams and other police equipment. Newark Post. https://www.newarkpostonline.com/news/newark-signs-3-8-million-10-year-deal-for-body-cams-and-other-police-equipment/article_12fbbed2-6519-11ef-8e38-dffece1c9636.html",,,,4/8/26,,,,,
04/08,Newark ,New Jersey,,,,License plate reader,Flock Safety ,Flock Safety ,,Law Enforcement,Active ,Organizational Use ,The reader gains access to data of images of license plates and sends this information to law enforcement. ,,,,,https://citizenportal.ai/articles/7310851/newark-approves-threeyear-renewal-with-flock-safety-for-licenseplate-readers-data-retention-extended,,,,"Citizen Portal. (2025, October 24). Newark approves three‑year renewal with flock safety for license‑plate readers; data retention extended. https://citizenportal.ai/articles/7310851/newark-approves-threeyear-renewal-with-flock-safety-for-licenseplate-readers-data-retention-extended",,,,4/8/26,,,,,
07/14,Santa Ana,California,Detection,,,Surveillance,Flock LPR Cameras ,Flock Safety,https://www.flocksafety.com/,Law Enforcement,Active,Organizational Use,"Flock Safety's License Plate Readers use AI image recognition and matching capabilities to match license plates read through devices with suspect license plates, leading to supposed recovery of stolen vehicles and criminal arrests.",www.calonews.com,,,,https://www.calonews.com/featured-topics/justice/birds-of-a-feather-flock-together-santa-ana-and-ice-s-efforts-to-surveil-you/article_9c9c6c70-273f-4a42-8057-ada1131e46da.html,,,,"Camacho, B. (2025, November 11). Birds of a feather flock together: Santa Ana and ICE’s efforts to surveil you. Retrieved February 2, 2026, from CaloNews.com website: https://www.calonews.com/featured-topics/justice/birds-of-a-feather-flock-together-santa-ana-and-ice-s-efforts-to-surveil-you/article_9c9c6c70-273f-4a42-8057-ada1131e46da.html",,,,2/1/26,2,0,,,
04/08,Santa Ana,California,,,,Drone Technology ,Skydio X10 ,"Skydio, Inc. ",,Law Enforcement,Active ,Organizational Use ,"This drone program is used for public safety, tracking crimes, natural disasters, and missing people. ",,,,,https://www.santa-ana.org/santa-ana-city-council-approves-police-drone-program-to-enhance-public-safety/,,,,"City of Santa Ana. (2026, February 6). Santa ana city council approves police drone program to enhance public safety. https://www.santa-ana.org/santa-ana-city-council-approves-police-drone-program-to-enhance-public-safety/",,,,4/8/26,,,,,
07/31,Cincinnati,Ohio,Detection,,,Gun Detection Technology,ShotSpotter,"SoundThinking, Inc.",https://www.soundthinking.com/,Law Enforcement,Active,Organizational Use,"ShotSpotter is an acoustic gunshot detection technology that can detect, locate, and alert police to all nearby gunshot incidents, therefore improving and increasing response to these crimes. In Cincinnati, this tool is installed on street lights or the side of buildings to detect and alert the police of gunshots, allowing for faster and more efficient tracking of suspects.",spectrumnews1.com,,,,https://spectrumnews1.com/oh/columbus/news/2025/05/02/police-cracking-down-on-gun-crimes-with-ai-technology--activists-raise-concerns,,,,"Elsie, S. (2025). Police cracking down on gun crimes with AI technology, activists raise concerns. Spectrumnews1.com. https://spectrumnews1.com/oh/columbus/news/2025/05/02/police-cracking-down-on-gun-crimes-with-ai-technology--activists-raise-concerns",,,,2/1/26,9,0,,,
07/31,Cincinnati,Ohio,Surveillance ,,,Security Robots,Autonomous Security Robot (ASR),Knightscope,,Law Enforcement,Inactive,Organizational Use,"Knightscope's Autonomous Security Robots provide surveillance and patrol through AI-generated analysis, continuous monitoring, and threat detection. Cincinnati police departments demoed these bots to explore their enhancement of policing and safety.",www.youtube.com,,,,https://www.youtube.com/watch?v=q8QpomnTClM,https://www.cincinnati.com/story/opinion/contributors/2024/02/19/cincinnati-should-abandon-experiments-with-ai-security-robots/72594835007/,,,"WCPO 9. (2023, November 30). Cincinnati police consider using security robots to prevent crime. YouTube. https://www.youtube.com/watch?v=q8QpomnTClM",,"Jeavons, I. (2024, February 19). Cincinnati police should avoid the use of AI security robots | Opinion. The Enquirer; Cincinnati Enquirer. https://www.cincinnati.com/story/opinion/contributors/2024/02/19/cincinnati-should-abandon-experiments-with-ai-security-robots/72594835007/",,2/1/26,9,0,,,
07/31,Cincinnati,Ohio,Back End Administration,,,Virtual Reality Training,Trainer,Jigsaw (unit under Google),,Law Enforcement,Inactive,Organizational Use,Jigsaw Trainer is a virtual reality simulation platform designed to help assist in training law enforcement on de-escalation techniques. The University of Cincinnati was selected to evaluate this new software in 2019 to evaluate the impact of this technology on officer behavior. ,www.uc.edu,,,,https://www.uc.edu/news/articles/2021/10/uc-partners-with-google-to-develop-vr-police-training.html,,,,"Koenig, A. (2021, October 26). UC to test and evaluate virtual reality police training technology. UC News. https://www.uc.edu/news/articles/2021/10/uc-partners-with-google-to-develop-vr-police-training.html",,,,2/1/26,9,0,,,
06/25,Cincinnati,Ohio,Back End Administration,,,Data Mining & Analysis,Digital Forensics and Criminal Intelligence Analysis,Ohio Narcotics Intelligence Center (ONIC),,Law Enforcement,Active,Organizational Use,"ONIC's Digital Forensics and Criminal Intelligence Analysis tools combine both AI and other resources to extract cyber evidence data related to a crime and analyze the evidence, filtering through it and providing further understanding for investigators.",www.govtech.com,,,,https://www.govtech.com/public-safety/ohio-narcotics-intelligence-center-expands-tech-operations,,,,"Edinger, J. (2022, April 27). Ohio Narcotics Intelligence Center Expands Tech Operations. GovTech. https://www.govtech.com/public-safety/ohio-narcotics-intelligence-center-expands-tech-operations",,,,2/1/26,9,0,,,
06/25,Cincinnati,Ohio,Front End Support,,,Juvenile Behavioral Risk Detection ,Clairity,Clarigent Health,,Courts,Inactive,Individual Use,"Clairity was an AI driven app that provided, transcribed, and analyzed mental health assessments to look for potential suicide risks. The tool was used in Cincinnati to help prevent youth suicide, but due to a lack of evidence signalling improvement from use and techincal issues, use stopped and the company and app were eventually shut down. ",local12.com,,,,https://local12.com/news/local/hamilton-county-court-first-in-country-to-use-artificial-intelligence-to-help-save-lives-cincinnati-juvenile-court-suicide-prevention-health-risks-behavioral-issues,,,,"Wheaton, C. (2021, June 29). How this Hamilton County court is using artificial intelligence to save young lives: WKRC. https://local12.com/news/local/hamilton-county-court-first-in-country-to-use-artificial-intelligence-to-help-save-lives-cincinnati-juvenile-court-suicide-prevention-health-risks-behavioral-issues",,,,2/1/26,9,0,,,
04/08,Cincinnati,Ohio,,,,Fusion Centers,Axon Fusus,"Axon Enterprise, Inc.",,Law Enforcement,Active ,Organizational Use ,"Fusus is an Axon system that facilitates access to live camera footage for police and funnels such feeds into real-time crime centers, susceptible to further analysis by artificial intelligence. ",,,,,https://www.cincinnati-oh.gov/police/news/cpd-launches-voluntary-community-camera-registry/,,,,CPD launches voluntary community camera registry. (2024). Cincinnati-Oh.gov. https://www.cincinnati-oh.gov/police/news/cpd-launches-voluntary-community-camera-registry/,,,,4/8/26,,,,,
04/08,Cincinnati,Ohio,,,,License Plate Readers,License Plate Readers,Flock Safety,,Law Enforcement,Active ,Organizational Use ,"Flock Safety's License Plate Readers use AI image recognition and matching capabilities to match license plates read through devices with suspect license plates, leading to supposed recovery of stolen vehicles and criminal arrests.",,,,,https://www.atlasofsurveillance.org/a/OHCIP0000ALPR,,,,OHCIP0000ALPR - Cincinnati Police Department uses Automated License Plate Readers. (2022). Atlasofsurveillance.org. https://www.atlasofsurveillance.org/a/OHCIP0000ALPR,,,,4/8/26,,,,,
04/08,Cincinnati,Ohio,,,,Drones,Drones as First Responders,"Axon Enterprise, Inc.",,Law Enforcement,Active ,Organizational Use ,These drones allow officers to see live footage and identify license plates and people from the air.,,,,,https://www.cincinnati-oh.gov/cityofcincinnati/display-objects/banners/cpd-launches-drones-as-first-responders-program/,,,,CPD Launches Drones as First Responders Program. (2024). Cincinnati-Oh.gov. https://www.cincinnati-oh.gov/cityofcincinnati/display-objects/banners/cpd-launches-drones-as-first-responders-program/,,,,4/8/26,,,,,
04/08,Cincinnati,Ohio,,,,Body Cameras,Axon Body 3,"Axon Enterprise, Inc.",,Law Enforcement,Active ,Organizational Use ,Axon Body Cameras record what officers see while on duty and provide important information about their surroundings.,,,,,https://www.cincinnati-oh.gov/police/department-references/police-department-procedure-manual/12540/,,,,Cincinnati Police Divsion. (2021). Body Worn Camera System.,,,,4/8/26,,,,,
08/28,Pittsburgh,Pennsylvania,Surveillance ,,,Facial Recognition Technology,Clearview AI,"Clearview AI, Inc. ",https://www.clearview.ai/,Law Enforcement,Active,Organizational Use,Clearview AI is a facial recognition company that collects and analyzes images from the internet to help law enforcement identify individuals by matching faces to a massive online photo database.,www.publicsource.org,,,,https://www.publicsource.org/pittsburgh-police-facial-recognition-blm-protests-clearview/,PA Attorney General Office Use,,,"Rihl, J. (2021, May 21). Emails show Pittsburgh police officers accessed Clearview facial recognition after BLM protests. Pittsburgh's Public Source. https://www.publicsource.org/pittsburgh-police-facial-recognition-blm-protests-clearview/",,,,10/20/25,8,0,2,6,Old RA's 
08/28,Pittsburgh,Pennsylvania,Prediction,,,Predictive Algorithm: Location Identification,Crime Hot-Spot Predictive Model,"Metro21, Carneggie Mellon University
Pittsburgh Bureau of Police
The ichard King Mellon Foundation",,Law Enforcement,Active,Organizational Use,Crime Spot predictor studies past 911 calls and police crime reports to predict which small areas of the city are most likely to experience serious violent crime next. The predictions help police identify “hot spots” before incidents occur.,www.cmu.edu,,,,https://www.cmu.edu/metro21/projects/smart-infrastructure/reducing-crime.html,,,,"Gor, W., & O'Neill, D. (n.d.). Pittsburgh Crime Hot Spot Project: Preventing Crime with Predictive Policing. Metro21: Smart Cities Institute. https://www.cmu.edu/metro21/projects/smart-infrastructure/reducing-crime.html",,,,10/20/25,8,0,2,6,Old RA's 
09/02,Pittsburgh,Pennsylvania,Back End Administration,,,Legal Research Platform,Counsel Stack ,Counsel Stack ,,Courts,Active,Organizational Use,"Counsel Stack uses artificial intelligence to accelerate and improve legal research and law-office operations: for example, it claims to process deep U.S. legal research queries in minutes instead of hours, provides structured citation verification, and aims to raise the baseline quality of work compared to traditional legal staffing.",www.post-gazette.com,,,,https://www.post-gazette.com/business/tech-news/2025/02/15/artificial-intelligence-law-firms-duquesene/stories/202502090042,Counsel Stack Interview with CEO,,,"Robinson, E. (2025, February 15). AI Trial: A Duquesne alum built an artificial intelligence platform for law firms. Clients aren't always told it's being used. Pittsburgh Post-Gazette. Retrieved September 2, 2025, from https://www.post-gazette.com/business/tech-news/2025/02/15/artificial-intelligence-law-firms-duquesene/stories/202502090042",,,,10/20/25,8,0,2,6,Old RA's 
09/02,Pittsburgh,Pennsylvania,Detection,,,Gun Detection Technology,Allgheny Family Screening Tool,Allegheny County Department of Human Services (DHS),,Law Enforcement,Active,Organizational Use,"The AFST is a predictive-risk-model built for the Allegheny County Department of Human Services that uses hundreds of administrative data points (child welfare, juvenile probation, behavioral health, criminal records) to generate a numeric “risk” score when a hotline report about a child is received, with the aim of informing whether an investigation should proceed.",www.cyber.pitt.edu,,,,https://www.cyber.pitt.edu/sites/default/files/Algorithms/Pittsburgh%20Task%20Force%20on%20Public%20Algorithms%20Report.pdf#page=10.99,PBS Deploys ShotSpotter,,,Pittsburgh Task Force on Public Algorithms. (n.d.). Report of the Pittsburgh Task Force on Public Algorithms. University of Pittsburgh. https://www.cyber.pitt.edu/sites/default/files/Algorithms/Pittsburgh%20Task%20Force%20on%20Public%20Algorithms%20Report.pdf#page=10.99\,,,,10/20/25,8,0,2,6,Old RA's 
09/02,Pittsburgh,Pennsylvania,Prediction,,,Pretrial Domestic Violence Risk Assessment,Sentence Risk Assessment Instrument,Pennsylvania Commission on Sentencing (PCS),,Courts,Active,Organizational Use,The Sentence Risk Assessment Instrument helps judges understand how likely a person is to commit another crime. It looks at basic information like age and past criminal history to place someone into low average or high risk groups. The judge still makes the final decision and uses the tool only for extra guidance.,pcs.la.psu.edu,,,,https://pcs.la.psu.edu/guidelines-statutes/risk-assessment/,,,,Pennsylvania Commission on Sentencing. (n.d.). Risk Assessment. Pennsylvania Commission on Sentencing. https://pcs.la.psu.edu/guidelines-statutes/risk-assessment/,,,,10/20/25,8,0,2,6,Old RA's 
06/11,Pittsburgh,Pennsylvania,Surveillance,,,Digital Evidence Sharing,NICE Justice,NICE Public Safety & Justice,,Law Enforcement,Active,Organizational Use,"NICE Justice is an AI-supported system that helps prosecutors manage and review digital evidence, including video, audio, and documents. It automates tasks like transcription, file sorting, and evidence intake to speed up case preparation.",www.cityandstatepa.com,,,,https://www.cityandstatepa.com/policy/2023/10/how-ai-poised-impact-government-and-vice-versa/391385/,,,,"Irvin-Mitchell, A. (2023, October 23). How AI is poised to impact government – and vice versa. City & State PA. https://www.cityandstatepa.com/policy/2023/10/how-ai-poised-impact-government-and-vice-versa/391385/",,,,10/20/25,8,0,2,6,Old RA's 
09/02,Pittsburgh,Pennsylvania ,,,,Automated License Plate Recognition,PlateSmart,"Cyclops Technologies, DBA PlateSmart Technologies",,Law Enforcement,Active ,Organizational Use ,"The Pittsburg Police Department uses an Automatic License Plate Reader (ALPR) System to scan license plates in real-time to identify stolen vehicles, stolen license plates, and wanted suspects, including those with outstanding warrants.",www.platesmart.com,,,,https://www.platesmart.com/credit-card-fraud-alpr-case-study/ ,https://www.pittsburghpa.gov/files/assets/city/v/1/public-safety/documents/manual-procedural-orders/69-02-public-safety-camera-system.pdf,,,,,,,2/8/26,8,0,,,
04/08,Pittsburgh,Pennsylvania ,,,,Body Cameras,Axon Body 4,"Axon Enterprise, Inc.",,Law Enforcement,Active ,Organizational Use ,Axon Body Cameras record what officers see while on duty and provide important information about their surroundings.,,,,,"https://www.govtech.com/public-safety/pittsburgh-enters-39m-contract-for-axon-police-tech#:~:text=Coghill%20said%20officials%20do%20not,to%20begin%20buying%20new%20vehicles.",,,,"Felton, J. (2023, June 28). Pittsburgh Enters $39M Contract for Axon Police Tech. GovTech. https://www.govtech.com/public-safety/pittsburgh-enters-39m-contract-for-axon-police-tech",,,,4/8/26,,,,,
08/01,St. Paul,Minnesota ,,,,AI aggregation and sentiment analysis of public social media posts/comments on community topics,Zencity,Zencity,https://zencity.io/zencity-for-public-safety/ ,Law Enforcement,Inactive ,Organizational Use ,Zencity aggregates public social media posts and applies AI-driven sentiment analysis to surface community opinions on local topics for government agencies.,www.cbsnews.com,,,,https://www.cbsnews.com/minnesota/news/cities-monitoring-resident-social-media-zencity/,,,,,,,,2/11/2026,1,0,0,1,Old RA's 
07/15,Greensboro,North Carolina,Back End Administration,,,ChatBot: Victim Assistance ,Enhanced Virtual Victim Assistant (EVVA),RTI International ,,Law Enforcement,Inactive,Organizational Use,"EVVA is a chatbot designed to address the lack of justice system-based resources available for burglary victims. From 2022-2023, RTI conducted an extensive pilot test of EVVA with the Greensboro Police Department (GPD), during which EVVA advised victims on what to expect after a burglary, steps to take to secure their residence, and provided department links. ",www.ojp.gov,,,,https://www.ojp.gov/library/publications/using-ai-enhance-victim-response,https://www.policechiefmagazine.org/using-ai-victim-response/?ref=d6a0f8068ea2455f73188056eefb791d,https://connectgreensboro.org/camera-integration/,,"Langton. L. et al. (2024, July) Using AI to Enhance Victim Response. Office of Justice Programs. https://www.ojp.gov/library/publications/using-ai-enhance-victim-response",,"Langton, L., & Brown, A. (2024). Using AI to Enhance Victim Response. IACP Police Chief. https://www.policechiefmagazine.org/using-ai-victim-response/?ref=d6a0f8068ea2455f73188056eefb791d", ,2/1/2026,3,0,,,
07/15,Greensboro,North Carolina,Surveillance,,,Camera Integration,Axon FususCORE & FususONE,"Axon Enterprise, Inc.",https://www.axon.com/,Law Enforcement,Active,Organizational Use,Axon Fusus uses AI to search and compile video footage from the GPD's integrated community camera system in order to mitigate criminal activity. ,connectgreensboro.org,,,,https://connectgreensboro.org/camera-integration/, ,,,Connect Greensboro (2025). Business Camera Integration. https://connectgreensboro.org/camera-integration/,, ,,2/1/2026,3,0,,,
04/06,Greensboro,North Carolina,,,,Surveillance,License Plate Readers,Flock Safety,,Law Enforcement,Active ,Organizational Use ,"Flock Safety's License Plate Readers use AI image recognition and matching capabilities to match license plates read through devices with suspect license plates, leading to supposed recovery of stolen vehicles and criminal arrests.",,,,,https://www.wfmynews2.com/article/news/community/greensboro-city-council-approves-installation-of-15-more-flock-safety-license-plate-cameras/83-7db157a3-fb90-44e0-8383-d7b8222ab1f7,,,,"Moraitis, M. (2022, September 7). Greensboro approves installation of 15 more safety cameras. Wfmynews2.com; WFMY. https://www.wfmynews2.com/article/news/community/greensboro-city-council-approves-installation-of-15-more-flock-safety-license-plate-cameras/83-7db157a3-fb90-44e0-8383-d7b8222ab1f7",,,,4/6/26,,,,,
09/04,Jersey City,New Jersey,,,,No AI Tech Found,,,,,,,,,,,,,,,,,,,,2/3/2026,1,0,,,
07/16,Durham ,North Carolina,Prediction,,,Predictive policing model,HunchLab,Azavea,,Law Enforcement,Inactive,Organizational Use,"The HunchLab tool was used to analyze data on previous gun-related offenses and other social factors, in order to identify potential future offenders. Azavea sold the HunchLab technology to Shotspotter in 2019.",digitaldefynd.com,,,,https://digitaldefynd.com/IQ/ai-use-in-predictive-policing/,"https://element84.com/company/why-we-sold-hunchlab/#:~:text=I'm%20encouraged%20by%20steps%20like%20the%20Google,Future%20of%20Life%20Institute's%20Autonomous%20Weapons%20Pledge.",,,"Team DigitalDefynd. (2024, August 10). How is AI being used in Predictive Policing? [2024]. Retrieved from DigitalDefynd website: https://digitaldefynd.com/IQ/ai-use-in-predictive-policing/",11/20/2025,,,,5,0,,,
07/16,Durham ,North Carolina,Prediction,,,Predictive modeling of recidivism risk,Automated Warrant Service Triage Tool,Research Triangle Institute (RTI),,Law Enforcement,Unsure,Organizational Use,"This automated warrant service triage tool by the Research Triangle Institute is used to analyze warrant records and predict the reoffending risk of past offenders, making the process of clearing through backlogs of unserved warrants much quicker.",www.ojp.gov,,,,https://www.ojp.gov/pdffiles1/nij/252038.pdf,,,,"Christopher Rigano, “Using Artificial Intelligence to Address Criminal Justice Needs,” NIJ Journal 280, January 2019, https://www.nij.gov/journals/280/Pages/using-artificialintelligence-to-address-criminal-justice-needs.aspx.",,,,11/20/2025,5,0,,,
